id,name,winner,incumbent,party,district,username,date,message,lengthofmessage,retweets,replies,quotes,likes,hasphoto,numofphoto,hasgif,hasvideo,ReplyingTo,ReplyToID,mentionedusers,numofmentions,hashtags,numofhashtags
1305642432978194435,"Hill, French",True,True,R,ARKANSAS 2,RepFrenchHill,09/14/2020 22:59:48,"This morning my staff was on hand to attend the opening of @CACArkansas' satellite center in #VanBurenCounty and present my letter of support. This facility has already helped 11 children since construction finished, and will continue to grow as a safe place for victims of abuse. https://t.co/gyfaSqqG1M",304,4,6,0,13,True,4,False,False,null,,CACArkansas,1,VanBurenCounty,1
1305592312177872898,"Hill, French",True,True,R,ARKANSAS 2,RepFrenchHill,09/14/2020 19:40:38,".@RepMcCaul and @HouseForeignGOP are absolutely right: we need to counter the #ChineseCommunistParty’s Belt &amp; Road Initiative and their “debt traps.” #CCP

Getting my bill, H.R. 5932, Ensuring Chinese Debt Transparency Act, signed into law is a great step in the right direction. https://t.co/ejOdNL878M",307,418,11,1,427,False,0,False,False,null,,"RepMcCaul,HouseForeignGOP",2,"ChineseCommunistParty,CCP",2
1305589341083836417,"Hill, French",True,True,R,ARKANSAS 2,RepFrenchHill,09/14/2020 19:28:50,"(2/2) On September 17, I'm hosting a round table with representatives from Sen. @JohnBoozman's office, @RepRickCrawford’s office, @VHALITPAO, and @VAVetBenefits to hear from women veterans in our community. 

To participate, contact me at 501-324-5941 or https://t.co/VrrmNaC4B1 https://t.co/086yWhhctZ",302,0,8,0,3,True,1,False,False,RepFrenchHill,1305589339913678850,"JohnBoozman,RepRickCrawford,VHALITPAO,VAVetBenefits",4,null,0
1305589339913678850,"Hill, French",True,True,R,ARKANSAS 2,RepFrenchHill,09/14/2020 19:28:49,"(1/2) One of my most important responsibilities as #central #Arkansas's representative in Congress is to ensure that the concerns of our men and women in uniform are heard. 

I'm launching the Women's Veteran Initiative: to advocate for the specific needs of our female veterans.",279,2,5,3,5,False,0,False,False,null,,null,0,"central,Arkansas",2
1305287645463867392,"Hill, French",True,True,R,ARKANSAS 2,RepFrenchHill,09/13/2020 23:30:00,"Recently, I recognized Jerry Evans for being named one of Arkansas's Outstanding Coaches of the year. 

Coach Evans led @SearcyHigh's Girls Wrestling Team to victory as the girls #Arkansas state champions. 

Congratulations to Coach Evans, Searcy High School, and @SearcySchools. https://t.co/mAEievRtyS",303,2,8,1,8,False,0,False,True,null,,"SearcyHigh,Searcyschools",2,Arkansas,1
1305194036672761858,"Hill, French",True,True,R,ARKANSAS 2,RepFrenchHill,09/13/2020 17:18:02,"Israel and Bahrain have agreed to normalize relations!

This is an important turn towards peace in the Middle East.

Bahrain and the UAE are the first Arab countries to take this step with Israel in more than two decades.
https://t.co/oKMzOZCRen",245,4,3,2,19,False,0,False,False,null,,null,0,null,0
1305168361530298371,"Hill, French",True,True,R,ARKANSAS 2,RepFrenchHill,09/13/2020 15:36:00,"(3/3) I was proud to support @PulaskiAR Judge Barry Hyde’s and the state’s grant application and commend @USDOT for investing in Arkansas’s transportation network, which will have a transformational effect on our area, benefiting generations to come.",250,0,0,0,3,False,0,False,False,RepFrenchHill,1305168360720740352,"PulaskiAR,USDOT",2,null,0
1305168360720740352,"Hill, French",True,True,R,ARKANSAS 2,RepFrenchHill,09/13/2020 15:36:00,"(2/3) U.S. Highway 67 is an urban freeway, linking the residents of #Cabot &amp; #Jacksonville w/ area employers, educational institutions, military facilities, &amp; retail centers. 

This grant will help central Arkansans move along Highway 67 more safely &amp; supports our local economy.",291,0,1,1,3,False,0,False,False,RepFrenchHill,1305168359923896322,null,0,"Cabot,Jacksonville",2
1305168359923896322,"Hill, French",True,True,R,ARKANSAS 2,RepFrenchHill,09/13/2020 15:36:00,"(1/3) Earlier this week, @myARDOT was awarded a $10 million Better Utilizing Investment to Leverage Development (BUILD) Grant from the U.S. Department of Transportation.

This is exciting news for #Arkansas, for #Pulaski County, and for @CityLittleRock!",253,1,5,0,6,False,0,False,False,null,,"myARDOT,CityLittleRock",2,"Arkansas,Pulaski",2
1304895816499367937,"Hill, French",True,True,R,ARKANSAS 2,RepFrenchHill,09/12/2020 21:33:01,"As we approach the end of #SuicidePreventionWeek, I wanted to conclude today on a positive note. 
 
The @FCC voted to make ""988"" a short-code to connect callers to the National Suicide Prevention Lifeline, 800-273-8255, a change I supported in 2018.
 
https://t.co/r1Dl4s0nU2",275,1,2,0,5,False,0,False,False,null,,FCC,1,SuicidePreventionWeek,1
1304839425877323778,"Hill, French",True,True,R,ARKANSAS 2,RepFrenchHill,09/12/2020 17:48:56,"Today we kicked off my 4th Future Leaders Council! These students joined Arkansas Senator Jane English and me via Zoom, and in person, socially-distanced.
 
I am proud of these students for their interest and excitement. I thank Sen English for being a part of this important day. https://t.co/pnHjDUvwda",304,3,2,0,15,True,2,False,False,null,,null,0,null,0
1304575645813530626,"Hill, French",True,True,R,ARKANSAS 2,RepFrenchHill,09/12/2020 00:20:46,"On the 19th anniversary of #September11, we remember those who lost their lives and honor those who sacrificed everything in order to save others. 

In today's @SalineCourier, I wrote about how we will always honor the fallen and #NeverForget who we lost on 9/11. https://t.co/1c0lMrx2aR",287,3,3,0,7,True,1,False,False,null,,SalineCourier,1,"September11,NeverForget",2
1304522074610978816,"Hill, French",True,True,R,ARKANSAS 2,RepFrenchHill,09/11/2020 20:47:54,This morning I joined @CityLittleRock Director Joan Adcock in packing food boxes at the Southwest Community Center to provide food for families in need. I am glad to see the funding that I supported for the #CARESAct being put into direct action to help our communities. https://t.co/7Tt8hkQZpZ,294,2,7,0,27,True,2,False,False,null,,CityLittleRock,1,CARESAct,1
1304447172696592388,"Hill, French",True,True,R,ARKANSAS 2,RepFrenchHill,09/11/2020 15:50:16,"On September 11, we remember the 2,977 victims who lost their lives. The 9/11 memorials at @FireConway and Searcy Fire Department reflect our community’s efforts to honor the bravery of the first responders who sacrificed everything in order to save others. We will #NeverForget. https://t.co/SwEnzsjUgP",303,3,4,0,10,False,0,False,True,null,,FireConway,1,NeverForget,1
1304209944766488576,"Hill, French",True,True,R,ARKANSAS 2,RepFrenchHill,09/11/2020 00:07:36,Tragically every 14 hours someone in Arkansas dies by suicide. Today my op-ed on suicide prevention was featured in @lcdonline to call attention to this dire issue and remind us what we can do. Help is available 24/7 through 911 or the suicide prevention lifeline: (800) 273-8255. https://t.co/WaEWTxpOg5,304,6,3,1,23,True,1,False,False,null,,lcdonline,1,null,0
1304153362171125761,"Hill, French",True,True,R,ARKANSAS 2,RepFrenchHill,09/10/2020 20:22:46,"Once again, every Senate Democrat, led by @SenSchumer, has blocked hundreds of billions of dollars in #COVID19 relief to American families &amp; small businesses.

Republicans are leading by legislating to defeat the #coronavirus while @SenateDems are playing games. #GetSerious",278,19,31,2,48,False,0,False,False,null,,"SenSchumer,SenateDems",2,"COVID19,coronavirus,GetSerious",3
1304126521687367680,"Hill, French",True,True,R,ARKANSAS 2,RepFrenchHill,09/10/2020 18:36:06,"The #COVID19 pandemic has been difficult for small businesses and restaurants in #Arkansas. 

Today, I spoke with local restaurant owners about what they need in the wake of this crisis. 

I will continue to advocate for small businesses and push for additional federal relief. https://t.co/36X6o9EQDd",301,3,6,3,7,True,1,False,False,null,,null,0,"COVID19,Arkansas",2
1304083676783878151,"Hill, French",True,True,R,ARKANSAS 2,RepFrenchHill,09/10/2020 15:45:51,"While jobless claims are again below 1 million, there are still millions of Americans who are out of work and struggling.

Congress must advance #bipartisan policies that will help rebuild our economy and provide relief to families, workers, and businesses who feel strained. https://t.co/hG6pQPZCmw",299,1,9,1,3,False,0,False,False,null,,null,0,bipartisan,1
1303843993944494081,"Hill, French",True,True,R,ARKANSAS 2,RepFrenchHill,09/09/2020 23:53:27,"The @arfoodbank has stepped up throughout this crisis by distributing 40 M lbs of food by 2021, and will add 20,000 ft of refrigerated space. I thank CEO Rhonda Sanders and CDO Sarah Riffle for showing me their facilities today and for their work caring for Arkansans. https://t.co/crEVs46aMW",292,2,4,1,15,True,4,False,False,null,,arfoodbank,1,null,0
1303758917000933376,"Hill, French",True,True,R,ARKANSAS 2,RepFrenchHill,09/09/2020 18:15:23,"Excellent news! @WaltonFamilyFdn will award $200k to Little Rock nonprofits on top of the $300k given to groups like @ARKidsRead and @CALibrarySystem. I am proud to have supported their efforts in addition to supporting #broadbandaccess virtual learning.

https://t.co/42z9epOjbz",279,4,1,0,10,False,0,False,False,null,,"WaltonFamilyFdn,ARKidsRead,CALibrarySystem",3,broadbandaccess,1
1303517329075175424,"Hill, French",True,True,R,ARKANSAS 2,RepFrenchHill,09/09/2020 02:15:24,"Thanks to @JaidTaylorLive and @heyallylynn for having me in studio this afternoon to “keep it real” on @965TheBox’s Hollywood Hangout.

You can listen to our interview on the radio tomorrow at 5:00 PM or by clicking on the link at the same time: https://t.co/ll7Ps9inXo https://t.co/f29nT56YWA",293,2,1,1,10,True,3,False,False,null,,"JaidTaylorLive,heyallylynn,965TheBox",3,null,0
1303475463524933632,"Hill, French",True,True,R,ARKANSAS 2,RepFrenchHill,09/08/2020 23:29:02,"There is nothing more essential than child welfare. 
 
Today I hosted a call with leaders from @TheProjectZer0; @CACArkansas; @ArkBaptNews;  The Call; @ARHumanServices; @ArkansasEd; &amp; @AsaHutchinson's office to discuss how we can keep Arkansas's kids safe and support foster care. https://t.co/BGJTwl75GL",308,2,5,1,11,True,1,False,False,null,,"TheProjectZer0,CACArkansas,ArkBaptNews,ARHumanServices,ArkansasEd,AsaHutchinson",6,null,0
1303022618560339968,"Hill, French",True,True,R,ARKANSAS 2,RepFrenchHill,09/07/2020 17:29:35,"Today on #LaborDay, I am reminded of hard-working Arkansans like JD Davis, a 20-year veteran with UPS who served our country as a Platoon Commander in the Gulf War. Last December, we teamed up for a ride-along in Conway on one of the busiest days of the year for @UPS. https://t.co/TyY4t16ofZ",292,4,6,2,15,True,3,False,False,null,,UPS,1,LaborDay,1
1302726203351146496,"Hill, French",True,True,R,ARKANSAS 2,RepFrenchHill,09/06/2020 21:51:45,"I'm committed to standing with freedom-loving people at home &amp; abroad. We must continue to hold authoritian leaders in Syria, Iran, &amp; Russia accountable. 

Assad's aggression against his own people is unacceptable. 

This app will inform the Syrian people &amp; help keep them safe. https://t.co/IERjRg5DeQ",314,73,29,5,241,False,0,False,False,null,,null,0,null,0
1302675837800656899,"Hill, French",True,True,R,ARKANSAS 2,RepFrenchHill,09/06/2020 18:31:36,"Today on #NationalReadABookDay I wanted to take this opportunity to share one of my favorite children's books about Arkansas, Lucky to Live in Arkansas by Kate Jerome.

I am excited to share a video I recorded with @librarycongress and @ArStateLibrary in the coming days. https://t.co/NZt3165FZX",295,1,3,0,10,True,1,False,False,null,,"librarycongress,ArStateLibrary",2,NationalReadABookDay,1
1302310549422829568,"Hill, French",True,True,R,ARKANSAS 2,RepFrenchHill,09/05/2020 18:20:05,"Inspired by this, I introduced the #WorldWarIValorMedalsReviewAct. 
 
This bipartisan bill was signed into law by @POTUS in the #NDAA and requires @DeptofDefense review the WWI military records of minority service members to determine if they should be awarded the Medal of Honor. https://t.co/z9kX7nrG9Q",304,0,2,0,4,False,0,False,True,RepFrenchHill,1302308961396367360,"POTUS,DeptofDefense",2,"WorldWarIValorMedalsReviewAct,NDAA",2
1302308961396367360,"Hill, French",True,True,R,ARKANSAS 2,RepFrenchHill,09/05/2020 18:13:46,"#YourIdeas help me better represent Arkansas and can lead to bills becoming law.
 
In October of 2018, I worked with Dr. Brian Mitchell from @UALR to award the family of Leroy Johnston medals he earned serving in WWI but did not receive due to discrimination. https://t.co/Z4uniOsSiY",283,2,3,2,2,True,1,False,False,null,,UALR,1,YourIdeas,1
1302055236656336896,"Hill, French",True,True,R,ARKANSAS 2,RepFrenchHill,09/05/2020 01:25:34,"Today I joined @rep_stevewomack, @TysonFoods President Dean Banks, and Chief Sustainability Officer John Tyson in Springdale to discuss how they have been adapting their supply chains and Human Resources practices to meet needs of #COVID19 and a rapidly changing business world. https://t.co/uN3mN5idkE",302,3,20,3,18,True,1,False,False,null,,"rep_stevewomack,TysonFoods",2,COVID19,1
1301867554647027714,"Hill, French",True,True,R,ARKANSAS 2,RepFrenchHill,09/04/2020 12:59:47,"Today’s #JobsReport makes the 4th straight month of decline in the unemployment rate at 8.4%! 

This is good news for workers across the country. We must continue to focus on pro-growth policies and cutting red tape to help our country get back to work
 
https://t.co/daNGghpHsz",278,5,4,1,13,False,0,False,False,null,,null,0,JobsReport,1
1301673724249284609,"Hill, French",True,True,R,ARKANSAS 2,RepFrenchHill,09/04/2020 00:09:34,"Thank you to Director Adcock, and members of @ARHungerRelief, for meeting with me today to talk about the food distribution program created by the #CARESAct to alleviate food deserts &amp; support communities in #PulaskiCounty. I am grateful for their tireless fight against hunger. https://t.co/Phce2gNM56",306,2,3,1,7,True,3,False,False,null,,ARHungerRelief,1,"CARESAct,PulaskiCounty",2
1301639470048063488,"Hill, French",True,True,R,ARKANSAS 2,RepFrenchHill,09/03/2020 21:53:27,"Appreciate business &amp; educational leaders from @ARDataSciences, @FirstOrionCorp, @lrchamber, @UALR @UALREIT, @ARDataSciences, @ArkansasEDC, @Dillards, @arcoding, @VentureCenter, &amp; @FISGlobal joining me for a discussion on comp programming education &amp; talent retention in #Arkansas https://t.co/oPGSe6toZQ",316,4,1,0,7,True,1,False,False,null,,"ARDataSciences,FirstOrionCorp,lrchamber,UALR,UALREIT,ARDataSciences,ArkansasEDC,Dillards,arcoding,VentureCenter,FISGlobal",11,Arkansas,1
1301515135916404737,"Hill, French",True,True,R,ARKANSAS 2,RepFrenchHill,09/03/2020 13:39:24,"Encouraging to see that jobless claims fell below 1 million!

However, millions of families, workers, and businesses are struggling because of the #coronavirus. 

Republicans and Democrats need to come together to defeat #COVID19, rebuild our economy, and restore our way of life. https://t.co/4FwSxKJmPY",304,6,6,2,14,False,0,False,False,null,,null,0,"coronavirus,COVID19",2
1323407040065249280,Joyce Elliott,False,False,D,ARKANSAS 2,xjelliott,11/02/2020 23:30:00,"Look how far we've come. 

Just a few months ago, folks weren't paying attention to us. Now, an overwhelming consensus of election experts say this is one of the closest races in the country.

Help us bring this home: https://t.co/aS4UEacWEH https://t.co/G6WTgph2F0",265,66,10,11,363,True,1,False,False,null,,null,0,null,0
1323371546812026881,Joyce Elliott,False,False,D,ARKANSAS 2,xjelliott,11/02/2020 21:08:58,1 day ➡️ https://t.co/Lvmft1peVj https://t.co/U7u6DSqCft,56,21,0,2,78,True,1,False,False,null,,null,0,null,0
1323355824048189443,Joyce Elliott,False,False,D,ARKANSAS 2,xjelliott,11/02/2020 20:06:29,Loved seeing so many supporters in Conway! https://t.co/slXW7OYMXm,66,17,4,5,329,True,1,False,False,null,,null,0,null,0
1323340406457774080,Joyce Elliott,False,False,D,ARKANSAS 2,xjelliott,11/02/2020 19:05:14,"Great to be out greeting voters in Van Buren County this morning!

For more voting information, visit https://t.co/QPCnY6aSX4 or call the Voter Protection Hotline if you experience any issues: (501) 299-5589 https://t.co/fi8tulTgsI",231,10,2,0,70,True,3,False,False,null,,null,0,null,0
1323313986184597514,Joyce Elliott,False,False,D,ARKANSAS 2,xjelliott,11/02/2020 17:20:14,"With so much at stake this election, we need someone in Congress who can work across the aisle and find common ground.

I am humbled to be endorsed by Faulkner County's Log Cabin Democrat (@lcdonline) because of my bipartisan track record. 

https://t.co/pZpiwgEDQb https://t.co/Nc6pm5umVn",289,21,1,1,70,True,1,False,False,null,,lcdonline,1,null,0
1323295393858334721,Joyce Elliott,False,False,D,ARKANSAS 2,xjelliott,11/02/2020 16:06:22,"Join @staceyabrams &amp; I tonight at 8pm over Zoom for some GOTV phone banking! Let's do this! #ARVoiceForJoyce

https://t.co/pjqwx6iyg0",137,31,3,6,112,False,0,False,False,null,,staceyabrams,1,ARVoiceForJoyce,1
1323293796436746240,Joyce Elliott,False,False,D,ARKANSAS 2,xjelliott,11/02/2020 16:00:01,"Today is the FINAL day to vote early. 

If you've already voted, send 5 friends to ➡️ https://t.co/AAlH4bwOlW https://t.co/W9Mg8cQIjL",133,15,2,5,60,True,1,False,False,null,,null,0,null,0
1323281925147156489,Joyce Elliott,False,False,D,ARKANSAS 2,xjelliott,11/02/2020 15:12:51,"BIG NEWS: Cook Political Report just called our race a Toss Up!

On the day before the election, this top-tier election forecaster made it clear that this is one of the closest races in the country.

Help us over the finish line: https://t.co/ySFF7pJjkh https://t.co/XYQiEeQsC3",277,56,6,11,305,True,1,False,False,null,,null,0,null,0
1323071269525508096,Joyce Elliott,False,False,D,ARKANSAS 2,xjelliott,11/02/2020 01:15:46,"Yay, Julie. In Greenbrier, right? https://t.co/uNtoVxFOe1",57,20,7,1,269,False,0,False,False,null,,null,0,null,0
1323010722142576644,Joyce Elliott,False,False,D,ARKANSAS 2,xjelliott,11/01/2020 21:15:11,Want to make this happen on Tuesday? Get involved: https://t.co/Lvmft1peVj https://t.co/7K6YHX8VCU,98,27,2,6,98,False,0,True,False,null,,null,0,null,0
1322636395803017218,Joyce Elliott,False,False,D,ARKANSAS 2,xjelliott,10/31/2020 20:27:44,"Thank you Little Rock! 

It is so important we all exercise our right to vote and make our voice heard ➡️ https://t.co/AAlH4bwOlW https://t.co/KglHubCDd3",153,25,3,1,158,True,2,False,False,null,,null,0,null,0
1322608682866278400,Joyce Elliott,False,False,D,ARKANSAS 2,xjelliott,10/31/2020 18:37:37,"Morrilton is showing UP to vote, y'all!

https://t.co/AAlH4bwOlW https://t.co/jVPbhbxT5C",88,24,6,6,245,True,4,False,False,null,,null,0,null,0
1322579493236690946,Joyce Elliott,False,False,D,ARKANSAS 2,xjelliott,10/31/2020 16:41:38,"Great to talk with voters in Searcy this morning!

For more voting information, visit https://t.co/QPCnY6aSX4 or call the Voter Protection Hotline if you experience any issues: (501) 299-5589 https://t.co/HC57uqGPxf",215,17,2,2,117,True,2,False,False,null,,null,0,null,0
1322558270184300546,Joyce Elliott,False,False,D,ARKANSAS 2,xjelliott,10/31/2020 15:17:18,"Remember: early voting is from 10am - 4pm today!

For more voting information, visit https://t.co/QPCnY6aSX4 or call the Voter Protection Hotline if you experience any issues: (501) 299-5589 https://t.co/g5lFnqWOMZ",214,22,0,3,103,True,1,False,False,null,,null,0,null,0
1322279815504867328,Joyce Elliott,False,False,D,ARKANSAS 2,xjelliott,10/30/2020 20:50:49,"Great to see so many voting in Southwest Little Rock today—including my former student!

For more voting information, visit https://t.co/QPCnY6aSX4 or call the Voter Protection Hotline if you experience any issues: (501) 299-5589 https://t.co/SWlm95PSpj",253,22,4,1,132,True,4,False,False,null,,null,0,null,0
1322260989455278082,Joyce Elliott,False,False,D,ARKANSAS 2,xjelliott,10/30/2020 19:36:00,"Thank you to everyone who voted at the Children's Library!

For more voting information, visit https://t.co/QPCnY6aSX4 or call the Voter Protection Hotline if you experience any issues: (501) 299-5589 https://t.co/fqkC6CM1H8",224,8,2,2,99,True,1,False,False,null,,null,0,null,0
1322249285069660160,Joyce Elliott,False,False,D,ARKANSAS 2,xjelliott,10/30/2020 18:49:30,"Thank you, North Little Rock!

For more voting information, visit https://t.co/QPCnY6aSX4 or call the Voter Protection Hotline if you experience any issues: (501) 299-5589 https://t.co/ckNyig3gGF",195,16,2,3,145,True,4,False,False,null,,null,0,null,0
1321905896968974336,Joyce Elliott,False,False,D,ARKANSAS 2,xjelliott,10/29/2020 20:05:00,"WOW—another elections forecaster, @DKElections, just rated our race a toss-up!

Experts around the country know how close this race is. Help us win: https://t.co/z4xWXuPZHK https://t.co/nJr1uiSC48",196,23,3,2,87,True,1,False,False,null,,DKElections,1,null,0
1321876327641845760,Joyce Elliott,False,False,D,ARKANSAS 2,xjelliott,10/29/2020 18:07:30,Five days. Help us win: https://t.co/Lvmft1peVj https://t.co/4ZW4Z8OGMN,71,23,2,4,91,True,1,False,False,null,,null,0,null,0
1321784604236414979,Joyce Elliott,False,False,D,ARKANSAS 2,xjelliott,10/29/2020 12:03:01,"Great to join Pancakes and Politics on @KARK4News! 

Today I'm flipping pancakes, and Tuesday I'll flip this district. https://t.co/8RND4obEWK",142,66,10,20,565,True,1,False,False,null,,KARK4News,1,null,0
1321568152514400256,Joyce Elliott,False,False,D,ARKANSAS 2,xjelliott,10/28/2020 21:42:55,"Election day is SIX days away! Already voted?

Make a difference by signing up to volunteer on election day!
https://t.co/sdnXugmacf",132,12,3,1,51,False,0,False,False,null,,null,0,null,0
1321559006469672960,Joyce Elliott,False,False,D,ARKANSAS 2,xjelliott,10/28/2020 21:06:35,https://t.co/jRg52rpamT https://t.co/JQZyilLCSH,47,32,5,6,167,False,0,False,False,null,,null,0,null,0
1321546025316749312,Joyce Elliott,False,False,D,ARKANSAS 2,xjelliott,10/28/2020 20:15:00,"This has NEVER happened in the history of our district:

Our race has officially been rated a Toss-Up!

@InsideElections knows this election will come down to the wire. Help us finish strong: https://t.co/jRg52r7yYj https://t.co/cxAsBg8qkX",239,74,6,26,361,True,1,False,False,null,,InsideElections,1,null,0
1321478678795177985,Joyce Elliott,False,False,D,ARKANSAS 2,xjelliott,10/28/2020 15:47:23,"Thanks, Governor Beebe! Make a plan to vote ➡️ https://t.co/AAlH4bwOlW https://t.co/dqz0oaNlTO",94,49,4,12,258,False,0,False,True,null,,null,0,null,0
1321461384488648705,Joyce Elliott,False,False,D,ARKANSAS 2,xjelliott,10/28/2020 14:38:40,"I am humbled to have the endorsement of Arkansas Governor Mike Beebe.

He's right. Most of us want to work together—regardless of political party. 

That's what I've done in the legislature, and you bet that's what I'll do in Congress. #arpx https://t.co/AR2FyCgw8b",265,104,11,24,558,False,0,False,True,null,,null,0,arpx,1
1321245400041463811,Joyce Elliott,False,False,D,ARKANSAS 2,xjelliott,10/28/2020 00:20:25,"Want to make a difference in this election? Already voted and looking for another way to help?

Sign up below to volunteer on one of our FINAL FOUR days before the election!

https://t.co/V4Htn1ObX5",198,20,7,4,58,False,0,False,False,null,,null,0,null,0
1321190647169228806,Joyce Elliott,False,False,D,ARKANSAS 2,xjelliott,10/27/2020 20:42:51,"My Republican colleagues agree—funding cancer research was a common sense step to help our state.

Unfortunately, our Congressman is putting partisanship over common sense. He won't even say he supports funding cancer research.

I'll work with anyone for the good of Arkansas. https://t.co/tupL7OHmgw",300,28,8,4,121,True,1,False,False,null,,null,0,null,0
1321127949639188480,Joyce Elliott,False,False,D,ARKANSAS 2,xjelliott,10/27/2020 16:33:43,"French Hill won't say if he supports bipartisan funding for cancer research and key infrastructure.

French Hill's extreme partisanship hurts Arkansans.

I don't care if an idea is from a Republican or a Democrat—just that it's good for Arkansas.

https://t.co/arCifYGIgL",271,24,1,2,105,False,0,False,False,null,,null,0,null,0
1321093040954613762,Joyce Elliott,False,False,D,ARKANSAS 2,xjelliott,10/27/2020 14:15:00,"There's so much at stake this election: better healthcare, COVID-19 recovery, and equal treatment under the law.

I've spent my life on my feet—in the classroom or standing with my neighbors. But now, I need you.

The lines are moving. Vote today ➡️ https://t.co/AAlH4bwOlW https://t.co/UXjk52dk0a",297,71,6,11,206,False,0,False,True,null,,null,0,null,0
1320809313812779014,Joyce Elliott,False,False,D,ARKANSAS 2,xjelliott,10/26/2020 19:27:34,"This election is Willisville vs. Wall Street.

French Hill puts his Wall Street buddies first while Arkansans pay the price.

I've always looked out for Arkansas communities big and small—even those the size of Willisville, my home town.

You bet I'll do the same in Congress. https://t.co/oCNNOJA58v",300,54,3,1,238,True,1,False,False,null,,null,0,null,0
1320398379332009991,Joyce Elliott,False,False,D,ARKANSAS 2,xjelliott,10/25/2020 16:14:40,"Thank you True Holiness Saints Center, Inc. for inviting me to help celebrate 27 years at your Pastor Appreciation Event this morning.

 It was truly heart-warming to hear all the ways you've inspired those not only within your church but in the community. https://t.co/gyDoVV5Cwd",280,11,5,2,134,True,1,False,False,null,,null,0,null,0
1320195542597685248,Joyce Elliott,False,False,D,ARKANSAS 2,xjelliott,10/25/2020 02:48:40,@mariamsiddiqui_ Big thank you!,31,0,1,0,14,False,0,False,False,mariamsiddiqui_,1320089758874374144,mariamsiddiqui_,1,null,0
