id,name,winner,incumbent,party,district,username,date,message,lengthofmessage,retweets,replies,quotes,likes,hasphoto,numofphoto,hasgif,hasvideo,ReplyingTo,ReplyToID,mentionedusers,numofmentions,hashtags,numofhashtags
1309247027029704704,"Guest, Michael",True,True,R,MISSISSIPPI 3,RepMichaelGuest,09/24/2020 21:43:10,"Yesterday, the pro-life community received great news. President Trump has said that he will advance the fight to protect children born alive after attempted abortions. This is a policy I have fought for since signing the Born-Alive Abortion Survivors Protection Act. https://t.co/P27BYQcC92",291,4,0,0,14,False,0,False,True,null,,null,0,null,0
1308493986814926849,"Guest, Michael",True,True,R,MISSISSIPPI 3,RepMichaelGuest,09/22/2020 19:50:51,"In our Commitment to America plan, Republicans are focusing on developing a safe vaccine in order to return our nation to prosperity. A vaccine will only be released if it is safe and effective! https://t.co/mHDjfGO1fo",218,34,29,3,191,True,1,False,False,null,,null,0,null,0
1308392973055463425,"Guest, Michael",True,True,R,MISSISSIPPI 3,RepMichaelGuest,09/22/2020 13:09:28,I joined @tatereeves and local leaders to announce a new economic development project that will bring hundreds of jobs to the region! https://t.co/Je3eSqfYlL,157,2,0,0,11,False,0,False,False,null,,tatereeves,1,null,0
1308136274415554566,"Guest, Michael",True,True,R,MISSISSIPPI 3,RepMichaelGuest,09/21/2020 20:09:26,"After reading the @HouseForeignGOP final report on the origins of the COVID-19 Pandemic, there can be no doubt that the Chinese Communist Party’s coverup allowed coronavirus to turn into a pandemic. They must be held accountable. 
https://t.co/pKbSZCb0Me",254,584,27,3,569,False,0,False,False,null,,HouseForeignGOP,1,null,0
1308058409514799105,"Guest, Michael",True,True,R,MISSISSIPPI 3,RepMichaelGuest,09/21/2020 15:00:02,"Democrats are wrong. The #AmericanDream is not dead. After years of left-wing attacks against our values, Republicans are focused on renewing the American Dream for every man and woman across our great nation.  #CommitmentToAmerica https://t.co/AiFaYkROwb",255,2,2,0,13,True,1,False,False,null,,null,0,"AmericanDream,CommitmentToAmerica",2
1307374922814107649,"Guest, Michael",True,True,R,MISSISSIPPI 3,RepMichaelGuest,09/19/2020 17:44:06,Today we remember the legacy of Ruth Bader Ginsberg. Justice Ginsburg gave her life in service to our nation.,109,3,3,0,20,False,0,False,False,null,,null,0,null,0
1307333635457134592,"Guest, Michael",True,True,R,MISSISSIPPI 3,RepMichaelGuest,09/19/2020 15:00:02,"When Republicans say, #CommitmentToAmerica we mean America first. As a strong, conservative Congressman, I pledge never to compromise the interests of our state or our nation, but instead work to promote prosperity for every American. https://t.co/1l6j5P4AM0",258,2,0,0,9,True,1,False,False,null,,null,0,CommitmentToAmerica,1
1306926191773794310,"Guest, Michael",True,True,R,MISSISSIPPI 3,RepMichaelGuest,09/18/2020 12:01:00,We recognize and honor those brave men and women who were prisoners of war or who never returned home. Your sacrifice is not forgotten. https://t.co/g6KdEz4mo7,159,1,1,1,5,True,1,False,False,null,,null,0,null,0
1306925946679619584,"Guest, Michael",True,True,R,MISSISSIPPI 3,RepMichaelGuest,09/18/2020 12:00:01,Mississippi has many distinguished #veterans and members of the @usairforce. We are thankful for their service and the 73 years their branch of the military has defended our nation. https://t.co/eBojw5fkkw,205,1,0,0,9,True,1,False,False,null,,usairforce,1,veterans,1
1306712960560234496,"Guest, Michael",True,True,R,MISSISSIPPI 3,RepMichaelGuest,09/17/2020 21:53:42,"It’s not a myth. Our officers are under attack. It’s time for all Members of Congress to say, “I #BackTheBlue.” https://t.co/hwBrOPbSHc",135,11,4,1,40,False,0,False,True,null,,null,0,BackTheBlue,1
1306608858002059264,"Guest, Michael",True,True,R,MISSISSIPPI 3,RepMichaelGuest,09/17/2020 15:00:02,"In our #CommitmentToAmerica promise, Republicans are focused on defeating the coronavirus and protecting our communities. Instead of shifting blame, Republicans are leading. Imagine what we can do with the House of Representatives. https://t.co/P8HVLBKKoe",255,15,33,4,48,True,1,False,False,null,,null,0,CommitmentToAmerica,1
1306563559804088321,"Guest, Michael",True,True,R,MISSISSIPPI 3,RepMichaelGuest,09/17/2020 12:00:02,"Today, let’s take time to be grateful for the document that has provided a strong foundation for our nation to grow and prosper. https://t.co/GdcCne8PGi",152,2,1,0,14,True,1,False,False,null,,null,0,null,0
1306222726978441216,"Guest, Michael",True,True,R,MISSISSIPPI 3,RepMichaelGuest,09/16/2020 13:25:41,"Republicans have made a #CommitmentToAmerica. Supporting the proven values &amp; virtues that have made our country great while recognizing &amp; learning from our mistakes is the path our nation must take to meet this commitment, &amp; @HouseGOP Republicans are ready to lead. https://t.co/n8dmA42TyV",301,22,38,2,85,True,1,False,False,null,,HouseGOP,1,CommitmentToAmerica,1
1305990805233045504,"Guest, Michael",True,True,R,MISSISSIPPI 3,RepMichaelGuest,09/15/2020 22:04:06,"Yesterday, legislation to honor three fallen officers passed the House of Representatives. These three men lost their lives in the line of duty and, with the passage of this legislation, we will ensure that their sacrifice is not forgotten.

https://t.co/dFvGcW0f7i",265,3,2,1,12,False,0,False,False,null,,null,0,null,0
1305951961766940673,"Guest, Michael",True,True,R,MISSISSIPPI 3,RepMichaelGuest,09/15/2020 19:29:45,It was an honor to join @SenHydeSmith &amp; @RepTrentKelly  at the @WhiteHouse to witness the historic signing of the #AbrahamAccords. This is a major milestone towards peace in the Middle East led by @realDonaldTrump &amp; his team. https://t.co/JHhv1OQ1MJ,257,10,8,3,62,True,1,False,False,null,,"SenHydeSmith,RepTrentKelly,WhiteHouse,realDonaldTrump",4,AbrahamAccords,1
1305853878722732032,"Guest, Michael",True,True,R,MISSISSIPPI 3,RepMichaelGuest,09/15/2020 13:00:00,"BREAKING: I’m joining my fellow Republicans this morning to announce our fall agenda - Commitment to America: restore our way of life, rebuild the greatest economy, and renew the American dream. 

https://t.co/pOgJfoV62i",220,39,33,6,200,False,0,False,False,null,,null,0,null,0
1305625013933015045,"Guest, Michael",True,True,R,MISSISSIPPI 3,RepMichaelGuest,09/14/2020 21:50:35,"President Trump has secured a historic step towards peace in the Middle East. After years of failures in the Obama Administration, this is undeniably a Republican victory led by @realDonaldTrump &amp; his @WhiteHouse team. https://t.co/Lu6QyrZw1b",246,2,0,0,9,True,1,False,False,null,,"realDonaldTrump,WhiteHouse",2,null,0
1305570086175080448,"Guest, Michael",True,True,R,MISSISSIPPI 3,RepMichaelGuest,09/14/2020 18:12:19,"Democrats are so focused on promoting the bad that anything positive for our nation is a “distraction.”

✅Peace Deals
✅A Growing Economy
✅COVID-19 Vaccine Phase 3 Trials
 
These are the facts that “distract” Nancy Pelosi and the radical left. https://t.co/OIOMitj1GA",266,3,4,0,11,False,0,False,False,null,,null,0,null,0
1304511239306043397,"Guest, Michael",True,True,R,MISSISSIPPI 3,RepMichaelGuest,09/11/2020 20:04:50,Our nation will #NeverForget this day and what it means to every citizen of our great country. https://t.co/RabZXDHxRG,118,2,0,0,16,False,0,False,True,null,,null,0,NeverForget,1
1304396038728495104,"Guest, Michael",True,True,R,MISSISSIPPI 3,RepMichaelGuest,09/11/2020 12:27:04,We will never forget the tragedy of the attacks on September 11th. Our nation is resilient. We are strong. https://t.co/blavhloKm9,130,4,0,0,13,True,1,False,False,null,,null,0,null,0
1304135224629043200,"Guest, Michael",True,True,R,MISSISSIPPI 3,RepMichaelGuest,09/10/2020 19:10:41,"A civilized nation should not justify the destruction of unborn children.

https://t.co/DCVv1qe9Jh",98,2,3,0,10,False,0,False,False,null,,null,0,null,0
1303754585606152192,"Guest, Michael",True,True,R,MISSISSIPPI 3,RepMichaelGuest,09/09/2020 17:58:10,"Since day 1 of the pandemic, I’ve said that American ingenuity and determination would help us overcome the challenge. Thanks to strong, conservative policies, the American people are getting back to work. https://t.co/LuBNIfFKUl",229,1,7,0,8,True,1,False,False,null,,null,0,null,0
1303488323739156483,"Guest, Michael",True,True,R,MISSISSIPPI 3,RepMichaelGuest,09/09/2020 00:20:08,"Don’t miss my conversation with Tony Perkins that aired this weekend. In the conversation, I discussed the important role that my faith plays in my life and my job. It’s always a pleasure talk with the @FRCdc about the importance of faith in our country.
https://t.co/ofNBKJumVy",278,1,3,2,7,False,0,False,False,null,,FRCdc,1,null,0
1303407766036512768,"Guest, Michael",True,True,R,MISSISSIPPI 3,RepMichaelGuest,09/08/2020 19:00:02,"Remind your friends and family to complete their census. The Third District, including the Jackson Metro area, Starkville, Meridian, and Southwest Mississippi, is behind in our count. We need your help. Complete your census and be counted!

https://t.co/LzgqwTQulx",264,2,1,1,3,False,0,False,False,null,,null,0,null,0
1303030800158543872,"Guest, Michael",True,True,R,MISSISSIPPI 3,RepMichaelGuest,09/07/2020 18:02:06,Happy Labor Day! https://t.co/pfUReWHt4V,40,1,1,0,12,True,1,False,False,null,,null,0,null,0
1302260200825552897,"Guest, Michael",True,True,R,MISSISSIPPI 3,RepMichaelGuest,09/05/2020 15:00:01,"Republicans will continue to work to create comprehensive and fair immigration legislation, which began with securing our southern border. https://t.co/VshXaPQJrr",162,1,4,1,5,True,1,False,False,null,,null,0,null,0
1301953976544489474,"Guest, Michael",True,True,R,MISSISSIPPI 3,RepMichaelGuest,09/04/2020 18:43:11,Our democracy is preserved by those who fight and who have fought for it. Republicans will always support our troops and ensure they are well-equipped so they can return home after serving their country. https://t.co/0X0UJF8vJr,227,41,52,2,120,True,1,False,False,null,,null,0,null,0
1301933887778689025,"Guest, Michael",True,True,R,MISSISSIPPI 3,RepMichaelGuest,09/04/2020 17:23:22,"American ingenuity is leading the resurgence of our job numbers while @realDonaldTrump and @HouseGOP Republicans are fighting to reduce regulations so Americans can get back to work!
 
https://t.co/Q15kQtGifj",208,1,1,0,5,False,0,False,False,null,,"realDonaldTrump,HouseGOP",2,null,0
1301641022838132736,"Guest, Michael",True,True,R,MISSISSIPPI 3,RepMichaelGuest,09/03/2020 21:59:37,"September is National Preparedness Month. As we prepare response efforts for an active hurricane season, we are asking you to develop your own plans. Please visit https://t.co/DrxBntRk7c for tips on an emergency plan that could help you and your family. 

https://t.co/9PlNKpEE7s",279,2,0,0,3,False,0,False,False,null,,null,0,null,0
1301527692781785091,"Guest, Michael",True,True,R,MISSISSIPPI 3,RepMichaelGuest,09/03/2020 14:29:17,"American greatness begins with the family. As a Republican, I believe in strong family values and robust opportunities for men and women to provide for their loved ones. https://t.co/UczleGIoOS",193,25,42,6,101,True,1,False,False,null,,null,0,null,0
1323350254977241088,"Palazzo, Steven",True,True,R,MISSISSIPPI 4,CongPalazzo,11/02/2020 19:44:22,"Republicans are committed to America because it's worth fighting for.  We want to: 

𝘙𝘦𝘴𝘵𝘰𝘳𝘦 our way of life
𝘙𝘦𝘣𝘶𝘪𝘭𝘥 the world's greatest economy
𝘙𝘦𝘯𝘦𝘸 the American dream

Read our commitment to America: https://t.co/w3hmAc7JBQ https://t.co/Usu0XztZrQ",251,1,9,0,6,True,1,False,False,null,,null,0,null,0
1322612451343503360,"Palazzo, Steven",True,True,R,MISSISSIPPI 4,CongPalazzo,10/31/2020 18:52:36,https://t.co/everyqxZ1r,23,1,2,0,2,True,1,False,False,null,,null,0,null,0
1322238324560568326,"Palazzo, Steven",True,True,R,MISSISSIPPI 4,CongPalazzo,10/30/2020 18:05:57,"HURRICANE ZETA RELIEF: Where to get help for food, ice, supplies and more https://t.co/bIoXPqw12B",97,2,0,0,0,False,0,False,False,null,,null,0,null,0
1322195659957641222,"Palazzo, Steven",True,True,R,MISSISSIPPI 4,CongPalazzo,10/30/2020 15:16:25,Below is a helpful graphic reviewing proper debris removal for anyone who is out clearing their yard / neighborhood today. https://t.co/P0XamiNDk4,146,1,1,0,3,False,0,False,False,null,,null,0,null,0
1321798606333108231,"Palazzo, Steven",True,True,R,MISSISSIPPI 4,CongPalazzo,10/29/2020 12:58:40,Praying for safety of our linemen in South Mississippi who will be restoring power to over 201K Mississippians following #Zeta,126,2,0,0,15,False,0,False,False,null,,null,0,Zeta,1
1321535670683389953,"Palazzo, Steven",True,True,R,MISSISSIPPI 4,CongPalazzo,10/28/2020 19:33:51,Open now ⬇️ https://t.co/qyOeX0LETF,35,0,0,0,2,False,0,False,False,null,,null,0,null,0
1321526039923838976,"Palazzo, Steven",True,True,R,MISSISSIPPI 4,CongPalazzo,10/28/2020 18:55:35,"I joined @SenatorWicker, @SenHydeSmith, and @RepMichaelGuest in sending @realDonaldTrump a letter for support for Governor Reeves's request for a Pre-Landfall Disaster Declaration ahead of #Zeta. 

MORE: https://t.co/4igakovgsm https://t.co/PEEuV8WAex",251,4,4,0,10,True,1,False,False,null,,"SenatorWicker,SenHydeSmith,RepMichaelGuest,realDonaldTrump",4,Zeta,1
1321513250056511489,"Palazzo, Steven",True,True,R,MISSISSIPPI 4,CongPalazzo,10/28/2020 18:04:45,#Zeta is officially a Category 2. https://t.co/q1tuHkFveW,57,2,0,0,0,False,0,False,False,null,,null,0,Zeta,1
1321450186724487168,"Palazzo, Steven",True,True,R,MISSISSIPPI 4,CongPalazzo,10/28/2020 13:54:10,South Mississippi - please be aware of the weather today as #Zeta makes its way to and through our area. https://t.co/agwkihBg1b,128,5,0,0,5,False,0,False,False,null,,null,0,Zeta,1
1321117305191997441,"Palazzo, Steven",True,True,R,MISSISSIPPI 4,CongPalazzo,10/27/2020 15:51:25,"Congratulations to @petalschools @drmattdillon for being named Mississippi's 2021 State Superintendent of the Year. I appreciate your leadership for our young students and the impact you have on their future. 

📸: Petal School District https://t.co/a3RXPlKNlz",259,0,1,0,6,True,1,False,False,null,,"petalschools,drmattdillon",2,null,0
1321114630966681603,"Palazzo, Steven",True,True,R,MISSISSIPPI 4,CongPalazzo,10/27/2020 15:40:47,CONFIRMED: Justice Amy Coney Barrett ➡️https://t.co/SRYpTvPOXH,62,1,4,0,1,False,0,False,False,null,,null,0,null,0
1321113857520185344,"Palazzo, Steven",True,True,R,MISSISSIPPI 4,CongPalazzo,10/27/2020 15:37:43,"The executive order requiring masks in certain counties in MS has been updated. The following counties in South Mississippi are under the mandate. 

-Harrison
-Jones
-Forrest
-Jackson
-Lamar

https://t.co/B8pOxmjfm7",215,1,1,0,0,False,0,False,False,null,,null,0,null,0
1321092674687016963,"Palazzo, Steven",True,True,R,MISSISSIPPI 4,CongPalazzo,10/27/2020 14:13:33,Coast cities issue mandatory harbor evacuations ahead of Zeta https://t.co/1ByzI4Kq3v,85,4,0,0,9,False,0,False,False,null,,null,0,null,0
1320887542359740417,"Palazzo, Steven",True,True,R,MISSISSIPPI 4,CongPalazzo,10/27/2020 00:38:25,"Judge Barrett's confirmation today is historic as she is only the 5th woman to serve on the Supreme Court. She is extremely qualified to fill this seat and will directly interpret the Constitution, upholding faith, family, &amp; freedom. 

Congratulations, 𝘑𝘶𝘴𝘵𝘪𝘤𝘦 Barrett! https://t.co/kj5rwrppXq",297,4,5,0,26,True,1,False,False,null,,null,0,null,0
1320877235629412355,"Palazzo, Steven",True,True,R,MISSISSIPPI 4,CongPalazzo,10/26/2020 23:57:28,#ConfirmACB https://t.co/2tcJZntsCb,35,13,13,2,148,False,0,False,False,null,,null,0,ConfirmACB,1
1320811145813467138,"Palazzo, Steven",True,True,R,MISSISSIPPI 4,CongPalazzo,10/26/2020 19:34:51,"Governor Reeves is now sharing a #COVID19 update for Mississippians. 

You can tune in by clicking the link below. https://t.co/QzkDA0Q7Oh",138,1,2,0,0,False,0,False,False,null,,null,0,COVID19,1
1320808155757088771,"Palazzo, Steven",True,True,R,MISSISSIPPI 4,CongPalazzo,10/26/2020 19:22:58,History is set to be made today in Washington. #ConfirmACB https://t.co/U9wsT8504z,82,1,7,0,7,False,0,False,False,null,,null,0,ConfirmACB,1
1320803406571855872,"Palazzo, Steven",True,True,R,MISSISSIPPI 4,CongPalazzo,10/26/2020 19:04:06,"Are you signed up to receive my newsletter? Stay up to date with the work I'm doing and what's happening in Congress. 

SIGN UP NOW: https://t.co/6ebBjX3D5x https://t.co/vcCUeOzmHo",180,1,1,0,2,True,1,False,False,null,,null,0,null,0
1320726115586084869,"Palazzo, Steven",True,True,R,MISSISSIPPI 4,CongPalazzo,10/26/2020 13:56:58,"South Mississippi - please be aware that Tropical Storm Zeta is expected to impact the Gulf Coast this week. Please continue monitoring key messages from local news and weather stations as well as the National Weather Service. 

Please use this time to prepare. https://t.co/eWXg3cIWGE",285,2,0,0,4,False,0,False,False,null,,null,0,null,0
1319734405318037504,"Palazzo, Steven",True,True,R,MISSISSIPPI 4,CongPalazzo,10/23/2020 20:16:16,"Our office is still accepting applications for internships in both our Washington and district offices. 

If you are interested in applying, please visit this link. https://t.co/YARa20ueYw",188,5,2,0,6,False,0,False,False,null,,null,0,null,0
1319700824533159938,"Palazzo, Steven",True,True,R,MISSISSIPPI 4,CongPalazzo,10/23/2020 18:02:50,"Latest COVID-19 numbers from Mississippi. 

Please remember the CDC-issued guidelines.

-Wear a mask
-Social distance
-Wash your hands
-Stay home if you're sick https://t.co/WcXIX6tPDE",184,2,1,1,1,False,0,False,False,null,,null,0,null,0
1319682433395118084,"Palazzo, Steven",True,True,R,MISSISSIPPI 4,CongPalazzo,10/23/2020 16:49:45,"Democrats continue ignoring real solutions to help the American people. 

Still, not one Democrat has signed @HerreraBeutler discharge petition to make already authorized #PPP loans available to struggling businesses.  

We can put people before politics. Americans need action. https://t.co/qAcSu0m1DU",302,33,17,3,95,False,0,False,False,null,,HerreraBeutler,1,PPP,1
1319382422967013381,"Palazzo, Steven",True,True,R,MISSISSIPPI 4,CongPalazzo,10/22/2020 20:57:37,"No. Senate Republicans showed up to do their job while members of your party boycotted their responsibilities. 

Just admit it - you’re only opposing her nomination because you hate @realDonaldTrump. 

She’s well-qualified to #FillTheSeat and should be confirmed. https://t.co/xdf303i8hF",287,0,4,0,2,False,0,False,False,null,,realDonaldTrump,1,FillTheSeat,1
1319369373879029760,"Palazzo, Steven",True,True,R,MISSISSIPPI 4,CongPalazzo,10/22/2020 20:05:46,"I am honored to be named a Friend of Farm Bureau by the Mississippi Farm Bureau. 

I will always support our farmers and ranchers through my position in Congress and as a member of the House Appropriations Committee. 

Thank you for this recognition @MSFarmBureau https://t.co/UfOBNGMkK0",287,3,1,0,6,False,0,False,False,null,,MSFarmBureau,1,null,0
1319368509403561985,"Palazzo, Steven",True,True,R,MISSISSIPPI 4,CongPalazzo,10/22/2020 20:02:19,Governor Reeves has reappointed Joe Spraggins to serve as the Executive Director of the Mississippi Department of Marine Resources once again. I know there’s no better man for the job and I look forward to working with him much more in the years to come. https://t.co/28sDNcpLLm,278,2,0,0,6,True,4,False,False,null,,null,0,null,0
1319326862787727364,"Palazzo, Steven",True,True,R,MISSISSIPPI 4,CongPalazzo,10/22/2020 17:16:50,"Great news! Judge Barrett's nomination will now move to the Senate floor for final confirmation. 

It's time to #ConfirmACB https://t.co/Y8cZwgnWOh",147,1,5,0,9,False,0,False,False,null,,null,0,ConfirmACB,1
1319278030863257603,"Palazzo, Steven",True,True,R,MISSISSIPPI 4,CongPalazzo,10/22/2020 14:02:48,"Congratulations to Ocean Springs' own Maj. Gen. Stephen N. Whiting for being promoted to lieutenant general and being named commander of the U.S. Space Force's first Field Command, Space Operations Command. 

https://t.co/5mwqWQ4INf",232,3,2,0,6,False,0,False,False,null,,null,0,null,0
1318650389823184896,"Palazzo, Steven",True,True,R,MISSISSIPPI 4,CongPalazzo,10/20/2020 20:28:46,"FACT: Not a single House Democrat has signed the discharge petition that would help our small businesses access the $138 billion of unused funds left in the. #PaycheckProtectionProgram

Hopefully, Senate Democrats will prioritize this legislation and send the House a relief bill. https://t.co/xgRrtJQjDk",304,66,28,9,149,False,0,False,False,null,,null,0,PaycheckProtectionProgram,1
1318649495186513927,"Palazzo, Steven",True,True,R,MISSISSIPPI 4,CongPalazzo,10/20/2020 20:25:13,"Republicans are fighting to support America's small businesses and have filed a discharge petition to vote on immediate relief legislation, but Democrats refuse to act and have blocked relief legislation from being voted on. 

It's past time to put the needs of Americans first. https://t.co/aNyl5RNrZV",302,35,19,9,83,False,0,False,False,null,,null,0,null,0
1318631204090900480,"Palazzo, Steven",True,True,R,MISSISSIPPI 4,CongPalazzo,10/20/2020 19:12:32,"100 years ago, the 19th Amendment was adopted and women were granted the right to vote. Today, I had the pleasure of speaking with the Pine Belt Republican women about this historical move, highlighting the tremendous contributions of women in America. https://t.co/9rm1283Edf",276,1,3,0,3,True,4,False,False,null,,null,0,null,0
1318606050728312840,"Palazzo, Steven",True,True,R,MISSISSIPPI 4,CongPalazzo,10/20/2020 17:32:35,"I'm asking everyone to continue being responsible when you're moving about in the community. The little things we do today will make a big difference tomorrow. 

-Wear a mask
-Keep a safe social distance
-Wash your hands
-Stay home if you're sick https://t.co/PIn1wPXVg3",270,0,1,0,2,False,0,False,False,null,,null,0,null,0
1318605736067420161,"Palazzo, Steven",True,True,R,MISSISSIPPI 4,CongPalazzo,10/20/2020 17:31:20,"Governor Reeves discussed the increase of COVID-19 cases around the state, reinstating a mask mandate in nine Mississippi counties. 

-Jackson
-Forrest
-Lamar
-Desoto
-Lee
-Chickasaw
-Clairborne
-Itawamba
-Neshoba",213,2,0,1,3,False,0,False,False,null,,null,0,null,0
1318239527417352193,"Palazzo, Steven",True,True,R,MISSISSIPPI 4,CongPalazzo,10/19/2020 17:16:09,"""Perhaps most importantly, we have made real progress on the border wall. More physical barriers go up every day, making our Border Patrol agents’ jobs easier and protecting our border communities.""  

@realDonaldTrump is securing our border &amp; making America safer. https://t.co/POdwZcLCXh",293,2,4,0,4,False,0,False,False,null,,realDonaldTrump,1,null,0
1318237650239868928,"Palazzo, Steven",True,True,R,MISSISSIPPI 4,CongPalazzo,10/19/2020 17:08:42,"The road to space runs through Mississippi. @NASAStennis is playing a key part in our pursuit to return to the moon. I’m proud to support this work that benefits south Mississippi’s economy &amp; cements American exceptionalism in space.  

https://t.co/7A6neqXpWe",264,2,0,0,3,False,0,False,False,null,,NASAStennis,1,null,0
1317196065817448453,"Palazzo, Steven",True,True,R,MISSISSIPPI 4,CongPalazzo,10/16/2020 20:09:49,"Did you catch my interview on the @jeff_poor show this morning? 

Tune in to hear my thoughts on how Congress should move forward on COVID-19 relief for the American people.

LISTEN: https://t.co/k8T9OnsL0y",206,3,4,0,8,False,0,False,False,null,,jeff_poor,1,null,0
1317145163081355265,"Palazzo, Steven",True,True,R,MISSISSIPPI 4,CongPalazzo,10/16/2020 16:47:32,"Latest #COVID numbers for Mississippi. 

•1,116 new cases
•9 news deaths
•128 LTC outbreaks

As a reminder, let's do the little things to make a big difference. 

•wear a mask
•social distance
•limit large gatherings
•wash your hands frequently

We will get through this💪 https://t.co/Gcw8TiqZNC",295,2,1,0,1,False,0,False,False,null,,null,0,COVID,1
1317142155065020424,"Palazzo, Steven",True,True,R,MISSISSIPPI 4,CongPalazzo,10/16/2020 16:35:35,"Conservative censorship by big tech companies like Facebook and Twitter has gone on for too long and must end.  

Censoring free speech because you disagree with the information is absolutely wrong on any account. Congress must act to hold these companies accountable. https://t.co/mu6tp3lZWp",292,81,27,3,160,False,0,False,False,null,,null,0,null,0
1317137845371478016,"Palazzo, Steven",True,True,R,MISSISSIPPI 4,CongPalazzo,10/16/2020 16:18:28,"Congress must come together and put the true needs of the American people first. Unfortunately, this is not the mindset of House &amp; Senate Democrats. 

Relief legislation must be targeted &amp; not filled with the liberal wishlist that Speaker Pelosi tried to cram through Congress. https://t.co/RfetUFycFO",309,26,35,4,75,True,1,False,False,null,,null,0,null,0
1317133986938966023,"Palazzo, Steven",True,True,R,MISSISSIPPI 4,CongPalazzo,10/16/2020 16:03:08,Looking forward to joining @jeff_poor this morning. You can listen in here: https://t.co/yS3Q53tMlF https://t.co/EO0XZkHjIK,123,3,1,0,4,False,0,False,False,null,,jeff_poor,1,null,0
1316801946561454082,"Palazzo, Steven",True,True,R,MISSISSIPPI 4,CongPalazzo,10/15/2020 18:03:43,It’s a beautiful day to join @supertalk in Jackson at the Friends of Mississippi Veterans 2nd Annual Clay Shoot. A great cause for our brave Mississippi heroes who honorably served in our Armed Forces. 🇺🇸 https://t.co/eDjgg3qa0S,228,2,1,0,4,True,1,False,False,null,,supertalk,1,null,0
1316793583131938819,"Palazzo, Steven",True,True,R,MISSISSIPPI 4,CongPalazzo,10/15/2020 17:30:29,"Slight delay! I’ll be joining the show in just a few minutes. 

Click the link on the tweet below to listen in. https://t.co/9ySn9jZg7h",135,1,0,0,0,False,0,False,False,null,,null,0,null,0
