id,name,winner,incumbent,party,district,username,date,message,lengthofmessage,retweets,replies,quotes,likes,hasphoto,numofphoto,hasgif,hasvideo,ReplyingTo,ReplyToID,mentionedusers,numofmentions,hashtags,numofhashtags
1318010903258869760,Antonia Eliason,False,False,D,MISSISSIPPI 1,Antonia4MS1,10/19/2020 02:07:41,"There may not be a silver bullet for healthcare, but there is Antonia Eliason. 

Stay tuned for our campaign ad. 👀

#AntoniaForCongress #AntoniaForMisssissippi #Antonia4MS1 https://t.co/0gMqef84i0",196,3,0,2,26,True,1,False,False,null,,null,0,"AntoniaForCongress,AntoniaForMisssissippi,Antonia4MS1",3
1317171484700385282,Antonia Eliason,False,False,D,MISSISSIPPI 1,Antonia4MS1,10/16/2020 18:32:08,We are the only state without early voting for all. During a pandemic. This is shameful and a clear example of voter suppression.  https://t.co/Tgv6PlJfaJ,154,13,0,1,24,False,0,False,False,null,,null,0,null,0
1316828963281473538,Antonia Eliason,False,False,D,MISSISSIPPI 1,Antonia4MS1,10/15/2020 19:51:05,@Mayukhkirandatt Thank you for participating! It was a pleasure to meet you and to hear your ideas. Here's to many more such conversations!,139,0,0,0,2,False,0,False,False,Mayukhkirandatt,1316828015033298945,Mayukhkirandatt,1,null,0
1316816914505752577,Antonia Eliason,False,False,D,MISSISSIPPI 1,Antonia4MS1,10/15/2020 19:03:12,"Discussion hosted by and captioning paid for by the Antonia for Mississippi Campaign Committee.

4/4",100,0,0,0,3,False,0,False,False,Antonia4MS1,1316816913624895488,null,0,null,0
1316816913624895488,Antonia Eliason,False,False,D,MISSISSIPPI 1,Antonia4MS1,10/15/2020 19:03:12,"-Mayukh Datta, Mississippi State University Senior; MSU Climate Reality Project, EEECHO (Educational, Environmental,Economic Community Health Organization of Gulfport), Starkville

-Catherine Janasie, Research Counsel, Mississippi Law Research Institute, Oxford

3/4",266,0,1,0,4,False,0,False,False,Antonia4MS1,1316816912714739714,null,0,null,0
1316816912714739714,Antonia Eliason,False,False,D,MISSISSIPPI 1,Antonia4MS1,10/15/2020 19:03:11,"With Campaign Manager Forrest Jenkins moderating, I’m happy to share the video of our discussion. Here, in their own words, are:
-Lydia Koltai, Herbalist at Elder Moon Apothecary; Citizens Climate Lobby, Oxford

-Steve Depew, Soil Scientist (retired) USDA-NRCS, Tupelo

2/4",273,0,1,0,4,False,0,False,False,Antonia4MS1,1316816911670403072,null,0,null,0
1316816911670403072,Antonia Eliason,False,False,D,MISSISSIPPI 1,Antonia4MS1,10/15/2020 19:03:11,"On October 8, I invited climate change and environmental activists, scientists, and legal experts from Northeast Mississippi to share their thoughts about the growing climate crisis and what steps we can take as communities to address them. 1/4
https://t.co/Dwa27D5pLo",268,5,1,1,8,False,0,False,False,null,,null,0,null,0
1316562416185073664,Antonia Eliason,False,False,D,MISSISSIPPI 1,Antonia4MS1,10/15/2020 02:11:55,"Initiative 65 is based on science and responsible medical care. Big Marijuana (as far as that exists) has nothing to do with this bill. 65A is pure politics to keep Mississippians from having access to necessary care. #vote65 
https://t.co/DVRcd9lnoP",250,7,0,1,18,False,0,False,False,null,,null,0,vote65,1
1316182654186856448,Antonia Eliason,False,False,D,MISSISSIPPI 1,Antonia4MS1,10/14/2020 01:02:52,"We are forging community and building infrastructure for a more progressive future. I see a bright future for us, because our spirits refuse to be dimmed and instead are lit by the fuel of just causes. 2/2",205,0,0,0,6,False,0,False,False,Antonia4MS1,1316182651489980418,null,0,null,0
1316182651489980418,Antonia Eliason,False,False,D,MISSISSIPPI 1,Antonia4MS1,10/14/2020 01:02:52,Thank you to Indivisible Northeast Mississippi for having me speak at their meeting today. Speaking to constituents who believe in progressive causes gets me fired up and reminds me that it's shameful that Mississippi Dems are routinely written off by the rest of the country. 1/2,280,1,1,0,14,False,0,False,False,null,,null,0,null,0
1315996934935654404,Antonia Eliason,False,False,D,MISSISSIPPI 1,Antonia4MS1,10/13/2020 12:44:53,"Even with my academic hat on, I'm writing about things that are key to my political campaign. The way we look at drugs domestically and internationally is problematic and we need to legalize medical cannabis as a tiny first step. Please vote for Initiative 65 (NOT 65A) on Nov. 3. https://t.co/u8ycxT2LKz",304,4,0,0,18,False,0,False,False,null,,null,0,null,0
1314790071606878211,Antonia Eliason,False,False,D,MISSISSIPPI 1,Antonia4MS1,10/10/2020 04:49:15,"How about both? We cannot wait while a Trump-packed Court strips away decades of progress of human rights. Court expansion is the best immediate solution, then we can follow up with (long) term limits to help prevent this same crisis in the future. https://t.co/jOMEHKSr1h",272,3,3,0,15,False,0,False,False,null,,null,0,null,0
1314377337123766273,Antonia Eliason,False,False,D,MISSISSIPPI 1,Antonia4MS1,10/09/2020 01:29:11,"Just recorded a fantastic climate change panel with some of the most knowledgeable and passionate folks I've had the good fortune of talking to on this subject. We'll be posting it in the next few days, so stay tuned. I came out of this conversation hopeful.",258,5,0,0,17,False,0,False,False,null,,null,0,null,0
1314202358251843584,Antonia Eliason,False,False,D,MISSISSIPPI 1,Antonia4MS1,10/08/2020 13:53:53,"The climate change responses were shameful. To repeatedly defend fracking and to provide no solutions or alternatives was embarrassing. It's like no one recognizes the urgency of climate change, and no one will until the coastal regions are all underwater. https://t.co/f0hIHyo1oC",280,3,1,0,8,False,0,False,False,null,,null,0,null,0
1314063766666051585,Antonia Eliason,False,False,D,MISSISSIPPI 1,Antonia4MS1,10/08/2020 04:43:10,@B1Crusade @chefcarney Throughout my campaign I have been clear on this: I believe in direct monetary reparations for descendants of slaves. I don't have all the answers now but I am learning who the voices are to listen to in order to make this a reality.  https://t.co/btW44iyAHQ,281,11,6,3,27,False,0,False,False,B1Crusade,1314058278213619718,"B1Crusade,chefcarney",2,null,0
1314058844046319616,Antonia Eliason,False,False,D,MISSISSIPPI 1,Antonia4MS1,10/08/2020 04:23:37,@keishajones @chefcarney is #ADOS based in Southern Mississippi and has been in contact with me over the course of my campaign.,127,0,1,1,10,False,0,False,False,keishajones,1314048311184306176,"keishajones,chefcarney",2,ADOS,1
1314047905200734208,Antonia Eliason,False,False,D,MISSISSIPPI 1,Antonia4MS1,10/08/2020 03:40:09,"Tomorrow I'm recording a virtual panel discussion on climate change with folks from my district. We did one last month on healthcare, available unedited on my social media. While @RepTrentKelly preaches behind closed doors, we prioritize the safety of our constituents. https://t.co/kR5P4acGeh",293,7,3,0,12,False,0,False,False,null,,RepTrentKelly,1,null,0
1314040072912633857,Antonia Eliason,False,False,D,MISSISSIPPI 1,Antonia4MS1,10/08/2020 03:09:01,"We've only got a few weeks left. This is the final push and we need funds to do digital and mail advertising before the election. We're entirely grassroots funded. I'm fighting for racial &amp; environmental justice. I'm fighting for the people. 
https://t.co/Mu6zMkiUvA",270,7,1,0,11,False,0,False,False,null,,null,0,null,0
1314018214020624384,Antonia Eliason,False,False,D,MISSISSIPPI 1,Antonia4MS1,10/08/2020 01:42:10,A #GreenNewDeal  means MORE jobs for Americans. Manufacturing jobs. Not service jobs. New technologies. A chance to become a world leader in fighting climate change and developing a sustainable future for our country. Joe Biden SHOULD ban fracking. #VicePresidentialDebate2020,276,3,0,0,10,False,0,False,False,null,,null,0,"GreenNewDeal,VicePresidentialDebate2020",2
1314017393132351490,Antonia Eliason,False,False,D,MISSISSIPPI 1,Antonia4MS1,10/08/2020 01:38:54,"We should abolish fossil fuels. To fight climate change, we need to come up with renewable sources. First step: end fossil fuel subsidies.",138,2,0,0,18,False,0,False,False,null,,null,0,null,0
1314000133747507200,Antonia Eliason,False,False,D,MISSISSIPPI 1,Antonia4MS1,10/08/2020 00:30:19,"The pandemic is having a disproportionate impact on women, on whom the responsibilities of childcare most often fall. We have no paid leave and no infrastructure to help women deal with these obligations. As a country, we are failing our women. 
https://t.co/kqAaG3z8vL",269,1,0,1,3,False,0,False,False,null,,null,0,null,0
1313655442229338114,Antonia Eliason,False,False,D,MISSISSIPPI 1,Antonia4MS1,10/07/2020 01:40:38,I've said this before. Let me reiterate: I support reparations for slavery. I want to see legislation at both state and federal levels that provides for reparations to those who have suffered due to slavery. Other countries have managed reparations. We can too. #ReparationsNow,277,192,47,26,547,False,0,False,False,null,,null,0,ReparationsNow,1
1313632661387333632,Antonia Eliason,False,False,D,MISSISSIPPI 1,Antonia4MS1,10/07/2020 00:10:07,"Fannie Lou Hamer's birthday was Oct. 6, 1917. Her courage, her perseverance, and her political and social activism inspire. When I was approached to run for Congress, her words, ""I'm sick and tired of being sick and tired"" echoed through my head. It is because of her that I run.",279,3,0,0,17,False,0,False,False,null,,null,0,null,0
1313595255258841090,Antonia Eliason,False,False,D,MISSISSIPPI 1,Antonia4MS1,10/06/2020 21:41:28,@CoriBush says it better than I could. Read this thread. Everything she says is absolute truth. https://t.co/KOdSND8Co7,119,3,0,0,1,False,0,False,False,null,,CoriBush,1,null,0
1313557828712509441,Antonia Eliason,False,False,D,MISSISSIPPI 1,Antonia4MS1,10/06/2020 19:12:45,"Few voices speak of and from and to Mississippi like that of @KieseLaymon. In his words: ""We cannot love Mississippi and accept Cindy Hyde-Smith as a senator of the Blackest, most abundant state in this nation. We do not have to be this way.""
https://t.co/jUSfzQfqWz",266,5,0,0,11,False,0,False,False,null,,KieseLaymon,1,null,0
1313308411648409601,Antonia Eliason,False,False,D,MISSISSIPPI 1,Antonia4MS1,10/06/2020 02:41:40,Alito and Thomas's words today were dangerous. Religious liberty means freedom of and from religion as you see fit. It does not mean imposing your views on others. I stand with the LGBTQ+ community. This right was fought for and is constitutional.  https://t.co/MHKdMl9ZW0,272,1,0,0,12,False,0,False,False,null,,null,0,null,0
1313294164973555713,Antonia Eliason,False,False,D,MISSISSIPPI 1,Antonia4MS1,10/06/2020 01:45:03,"Every American deserves healthcare. While the president tells us not to be afraid of COVID-19 while receiving the best care possible, currently, many Americans are afraid of treatable conditions like high blood pressure because they can't afford any medical care at all.",270,10,0,1,21,False,0,False,False,null,,null,0,null,0
1312741880694792193,Antonia Eliason,False,False,D,MISSISSIPPI 1,Antonia4MS1,10/04/2020 13:10:28,"This week I'll be recording a panel on climate change with some experts from my district. From insect population collapse to climate grief, I see its effects around me on a daily basis. I want to hear ways in which climate change is impacting your life. Drop a comment or DM me.",278,3,0,1,12,False,0,False,False,null,,null,0,null,0
1311129687956041730,Antonia Eliason,False,False,D,MISSISSIPPI 1,Antonia4MS1,09/30/2020 02:24:11,Neither candidate understands the urgency of climate change. End fossil fuel subsidies.,87,2,0,0,12,False,0,False,False,null,,null,0,null,0
1311128702047133702,Antonia Eliason,False,False,D,MISSISSIPPI 1,Antonia4MS1,09/30/2020 02:20:16,End fossil fuel subsidies. This would be a huge step towards combating climate change.,86,0,0,0,7,False,0,False,False,null,,null,0,null,0
1311128416327008256,Antonia Eliason,False,False,D,MISSISSIPPI 1,Antonia4MS1,09/30/2020 02:19:08,@realDonaldTrump you want crystal clean water and air but you repeal EPA regulations. And you're focused on raking forests. Climate change is the greatest threat we've ever faced. Repealing laws won't do it. We need renewable energy. FOREST FIRES DON'T CAUSE CLIMATE CHANGE!,274,0,0,0,0,False,0,False,False,null,,realDonaldTrump,1,null,0
1311127777345757184,Antonia Eliason,False,False,D,MISSISSIPPI 1,Antonia4MS1,09/30/2020 02:16:36,This is not a debate. This is a disgrace.,41,0,0,0,9,False,0,False,False,null,,null,0,null,0
1311123477538238465,Antonia Eliason,False,False,D,MISSISSIPPI 1,Antonia4MS1,09/30/2020 01:59:31,"""The African American population community"" tells you all you need to know. Follow that with a list of support of law enforcement and a shout out to law and order, and you know that this is exactly the dog whistle that Biden has called Trump out for. #BLM #DefundThePolice",272,0,0,0,4,False,0,False,False,null,,null,0,"BLM,DefundThePolice",2
1311114592442093568,Antonia Eliason,False,False,D,MISSISSIPPI 1,Antonia4MS1,09/30/2020 01:24:12,"We need universal healthcare. We need #MedicareForAll. We need more than just ObamaCare because we need something that can't be reduced, can't be marginalized, can't be picked at - we need healthcare for ALL Americans. ALL the time.",232,0,0,0,11,False,0,False,False,null,,null,0,MedicareForAll,1
1311112734860337154,Antonia Eliason,False,False,D,MISSISSIPPI 1,Antonia4MS1,09/30/2020 01:16:49,"@realDonaldTrump you say that drug prices are coming down. It's going to go down, you say. Insulin is like water, you say. My constituents haven't experienced this. This is pure grandstanding. Instead, the price of COVID-19 drugs has increased.",244,0,0,0,0,False,0,False,False,null,,realDonaldTrump,1,null,0
1310940652117557253,Antonia Eliason,False,False,D,MISSISSIPPI 1,Antonia4MS1,09/29/2020 13:53:02,"A reminder that while climate change isn't included as a topic for tonight's debate, it's the single greatest threat to ever face humankind. This is an existential threat that should be at the center of discussion. Doing nothing isn't a solution. It won't go away if we ignore it.",280,3,0,0,8,False,0,False,False,null,,null,0,null,0
1310370851108384768,Antonia Eliason,False,False,D,MISSISSIPPI 1,Antonia4MS1,09/28/2020 00:08:51,"The very wealthy and large corporations in America pay far too little in taxes. When normal folks pay a lot more in federal taxes each year than people like Donald Trump, it's time to revisit the system and make sure that those who can least afford it don't bear all the burden.",278,5,0,1,19,False,0,False,False,null,,null,0,null,0
1309894990965993472,Antonia Eliason,False,False,D,MISSISSIPPI 1,Antonia4MS1,09/26/2020 16:37:57,"Discussion hosted by and captioning paid for by the Antonia for Mississippi Campaign Committee.

8/8",100,0,0,0,0,False,0,False,False,Antonia4MS1,1309894990156488707,null,0,null,0
1309894990156488707,Antonia Eliason,False,False,D,MISSISSIPPI 1,Antonia4MS1,09/26/2020 16:37:56,I realized I knew less about how this system affects the health care professionals who work in the hospitals or own small businesses that serve the people in this district. Speaking to these amazing healthcare professionals was really eye-opening. 7/8,251,0,1,0,1,False,0,False,False,Antonia4MS1,1309894989414100992,null,0,null,0
1309894989414100992,Antonia Eliason,False,False,D,MISSISSIPPI 1,Antonia4MS1,09/26/2020 16:37:56,"I know America’s current system (heavy regulation of access by private insurance companies, arbitrary geographic and income boundaries) reduces access to health coverage for individuals. 6/8",190,0,1,0,0,False,0,False,False,Antonia4MS1,1309894988642295809,null,0,null,0
1309894988642295809,Antonia Eliason,False,False,D,MISSISSIPPI 1,Antonia4MS1,09/26/2020 16:37:56,"Health care consumers with consistent, affordable access to basic health services enjoy greater financial security than those who do not. The countries that invest in health care for all enjoy the economic benefits of their residents’ long term health and financial security. 5/8",279,0,1,0,0,False,0,False,False,Antonia4MS1,1309894987774124034,null,0,null,0
1309894987774124034,Antonia Eliason,False,False,D,MISSISSIPPI 1,Antonia4MS1,09/26/2020 16:37:56,"My commitment to universal health care begins with my understanding that every person needs professional health care, and health care professionals are worth investing in. 4/8",175,0,1,0,0,False,0,False,False,Antonia4MS1,1309894986989699074,null,0,null,0
1309894986989699074,Antonia Eliason,False,False,D,MISSISSIPPI 1,Antonia4MS1,09/26/2020 16:37:56,"-Keri Mills, PharmD, BCPS, ICU Pharmacist, Baptist Memorial Hospital, Columbus
-Dr. Chris Park, MD, Physician, Park Medical Clinic, Pontotoc.

3/8",146,0,1,0,0,False,0,False,False,Antonia4MS1,1309894986180243456,null,0,null,0
1309894986180243456,Antonia Eliason,False,False,D,MISSISSIPPI 1,Antonia4MS1,09/26/2020 16:37:56,"With campaign manager Forrest Jenkins moderating, here, in their own words, are:
-Dr. Joshua Fulwiler, Ph.D., Clinical Psychologist, Cardinal Clinical Consulting, Tupelo
-Bridgett Green, MSN, NP-C, Nurse Practitioner, Oxford Specialty Clinic, Oxford
2/8",253,0,1,0,0,False,0,False,False,Antonia4MS1,1309894985270153216,null,0,null,0
1309894985270153216,Antonia Eliason,False,False,D,MISSISSIPPI 1,Antonia4MS1,09/26/2020 16:37:55,"On Sept. 21, 2020, I invited professional health care providers from around District 1 to share their experiences and challenges in delivering the best care to their patients. I’m happy to share the video of our discussion. 1/8
https://t.co/Vl4vRuLIlx",251,2,1,0,5,False,0,False,False,null,,null,0,null,0
1309566067556089863,Antonia Eliason,False,False,D,MISSISSIPPI 1,Antonia4MS1,09/25/2020 18:50:55,"I want to see cannabis legalized recreationally and medically at a federal level. But right now, in Mississippi, we have a chance to take the first step and legalize medical marijuana. Vote for Initiative 65 NOT for Initiative 65A. #vote65 https://t.co/8lCPjvkP3X 2/2",267,5,1,0,9,False,0,False,False,Antonia4MS1,1309566066625056774,null,0,vote65,1
1309566066625056774,Antonia Eliason,False,False,D,MISSISSIPPI 1,Antonia4MS1,09/25/2020 18:50:55,I strongly believe in legalizing cannabis. I've written extensively on the subject with @howserob. Here's an academic article we wrote looking at international law implications of legalization through the lens of Canada's bill. #LegalizeMarijuana 1/2 https://t.co/WkdwR13elr,274,2,2,0,10,False,0,False,False,null,,howserob,1,LegalizeMarijuana,1
1309481546198515719,Antonia Eliason,False,False,D,MISSISSIPPI 1,Antonia4MS1,09/25/2020 13:15:04,"Curious where I stand on issues? Read more about my platform in Mississippi Today's 2020 Voter Guide.
https://t.co/cNISBdyPgM",125,8,1,1,19,False,0,False,False,null,,null,0,null,0
1309156783592800264,Antonia Eliason,False,False,D,MISSISSIPPI 1,Antonia4MS1,09/24/2020 15:44:34,Important information on voting absentee in Mississippi. Please read and share widely. https://t.co/y2T7JkqxRc,110,6,0,0,5,True,1,False,False,null,,null,0,null,0
1308934726204502024,Antonia Eliason,False,False,D,MISSISSIPPI 1,Antonia4MS1,09/24/2020 01:02:12,@wspittman Apologies if that tweet was unclear. I did not mean it to be read as such. I am making this absolutely clear now: court expansion is the best immediate solution and something we need to pursue now. I try to be as clear as possible in my tweets but I fell short this time.,282,0,1,1,2,False,0,False,False,wspittman,1308934144274182146,wspittman,1,null,0
1308933627238023171,Antonia Eliason,False,False,D,MISSISSIPPI 1,Antonia4MS1,09/24/2020 00:57:50,"@wspittman I would happily see an expansion of the courts right now, and I absolutely support it, but I think we must be open to discussing the possibility of long-term reform at the same time.",193,0,1,0,0,False,0,False,False,wspittman,1308933015029121024,wspittman,1,null,0
1308931439984021504,Antonia Eliason,False,False,D,MISSISSIPPI 1,Antonia4MS1,09/24/2020 00:49:08,"When a nation sits on the edge of their seats based on the health of Supreme Court Justices, there is something fundamentally flawed with the system. Having (long) term limits would be the best way to fix it. More justices is an easier solution, but sometimes easier isn't best.",278,1,3,0,13,False,0,False,False,null,,null,0,null,0
1308484739284840448,Antonia Eliason,False,False,D,MISSISSIPPI 1,Antonia4MS1,09/22/2020 19:14:06,"Opposition to Initiative 65 is pure fear-mongering. Vote to legalize medical marijuana for those who need it - vote for 65 NOT for 65A, which would limit it to terminally ill patients. #votefor65 #legalizemarijuana
https://t.co/SuhmnDcwwa",238,20,4,1,40,False,0,False,False,null,,null,0,"votefor65,legalizemarijuana",2
1308209568162500608,Antonia Eliason,False,False,D,MISSISSIPPI 1,Antonia4MS1,09/22/2020 01:00:41,"Tonight I did a virtual panel on healthcare with some amazing healthcare professionals from my district. We'll be posting it in the next few days, so stay tuned. This is the first in a series of listening sessions with constituents on issues that matter to me and to our district.",280,5,0,1,28,False,0,False,False,null,,null,0,null,0
1307361785637470210,Antonia Eliason,False,False,D,MISSISSIPPI 1,Antonia4MS1,09/19/2020 16:51:53,"It's speculative. Small scale investing is unlikely to make you rich. Markets themselves aren't tied to actual values of assets, companies, or anything real. It's just a form of super legitimized gambling that we've accepted as a metric for how well our real economy is doing. 2/2",280,1,0,0,9,False,0,False,False,Antonia4MS1,1307361784807002118,null,0,null,0
1307361784807002118,Antonia Eliason,False,False,D,MISSISSIPPI 1,Antonia4MS1,09/19/2020 16:51:53,"The idea that if more people could invest in the financial markets we would have less wealth inequality is like saying that if more people had access to baccarat tables, we'd have more rich people. 1/2
https://t.co/muCQcLH60d",225,1,1,0,15,False,0,False,False,null,,null,0,null,0
1307105109067862016,Antonia Eliason,False,False,D,MISSISSIPPI 1,Antonia4MS1,09/18/2020 23:51:57,"The loss of Ruth Bader Ginsburg is an immense loss for our country and for our judiciary. She was an inspiration for generations of women law students and lawyers and her tenacity, character and commitment to her profession was something all lawyers should aspire to.",267,9,0,0,33,False,0,False,False,null,,null,0,null,0
1306350982289338371,Antonia Eliason,False,False,D,MISSISSIPPI 1,Antonia4MS1,09/16/2020 21:55:19,"""Strikes and work stoppages are illegal in Mississippi."" That's the problem. This gives employers the power to dictate the terms and conditions that workers face while silencing them. I will fight for workers' rights. I will fight for the right to strike. I will fight for unions. https://t.co/dyxLkKSYOS",304,32,5,1,96,False,0,False,False,null,,null,0,null,0
1306029192061104129,Antonia Eliason,False,False,D,MISSISSIPPI 1,Antonia4MS1,09/16/2020 00:36:38,"This should not be controversial. ICE is neither necessary, nor a constitutionally mandated part of our government. ICE is a tool of oppression and directly responsible for committing crimes against humanity. #AbolishICE https://t.co/PLZThri5Dx",244,4,0,0,29,False,0,False,False,null,,null,0,AbolishICE,1
1303524316018081792,Antonia Eliason,False,False,D,MISSISSIPPI 1,Antonia4MS1,09/09/2020 02:43:09,"We need to support rural initiatives that endorse in universal healthcare, sustainable agricultural policies and rural concerns from a progressive standpoint. As a Mississippi progressive, rural policies are front and center to my campaign. #GreenNewDeal #M4A #VoteAntonia https://t.co/bhtIUqWaGd",296,5,1,1,21,False,0,False,False,null,,null,0,"GreenNewDeal,M4A,VoteAntonia",3
1303390565174784000,Antonia Eliason,False,False,D,MISSISSIPPI 1,Antonia4MS1,09/08/2020 17:51:41,"Nine years ago I was released from the hospital after nearly dying from a severe kidney infection. I was hospitalized for several days, pumped full of IV antibiotics, given pain medication, X-rayed. The cost? $0. Because I was in England. I want that for Americans too. #M4A",274,7,1,0,33,False,0,False,False,null,,null,0,M4A,1
1301323657696993284,Antonia Eliason,False,False,D,MISSISSIPPI 1,Antonia4MS1,09/03/2020 00:58:32,The sample ballot for Mississippi on the medical marijuana vote is intentionally hard to understand. You will need to vote both for the approval of either initiative AND also for initiative 65. DO NOT VOTE FOR 65A! #legalizemarijuana  #MedicalCannabis #votefor65 https://t.co/gPAU7E1G6W,286,45,1,3,55,True,1,False,False,null,,null,0,"legalizemarijuana,MedicalCannabis,votefor65",3
1323095122318426112,Antonia Eliason,False,False,D,MISSISSIPPI 1,AntoniaEliason,11/02/2020 02:50:33,"My pre-election anxiety has manifested itself in an intense need to watch Mel Brooks films. The other night was Blazing Saddles, which Tom knows all the lines to. But tonight I got to introduce him to The History of the World Part I. The Inquisition, what a show...",265,0,1,0,2,False,0,False,False,null,,null,0,null,0
1323012421221519368,Antonia Eliason,False,False,D,MISSISSIPPI 1,AntoniaEliason,11/01/2020 21:21:56,"There is nothing like a looming election and a firm deadline for a very overdue academic writing project to get you motivated to finish writing. Balancing a full-time+ job as an academic and campaigning in a pandemic has been interesting, to say the least.",256,0,0,0,2,False,0,False,False,null,,null,0,null,0
1322313163048689664,Antonia Eliason,False,False,D,MISSISSIPPI 1,AntoniaEliason,10/30/2020 23:03:20,"@watts_up_eric Just watched it. Powerful and true. And very accurate about how international law notwithstanding, it's about how domestic courts interpret the Refugee Convention. Thanks for sharing.",198,0,0,0,1,False,0,False,False,watts_up_eric,1322013649624588288,watts_up_eric,1,null,0
