id,name,winner,incumbent,party,district,username,date,message,lengthofmessage,retweets,replies,quotes,likes,hasphoto,numofphoto,hasgif,hasvideo,ReplyingTo,ReplyToID,mentionedusers,numofmentions,hashtags,numofhashtags
1315724287639277568,"Feenstra, Randy",True,False,R,IOWA 4,RandyFeenstra,10/12/2020 18:41:29,"#IA04’s farmers feed and fuel the world, and on this #NationalFarmersDay I want to say thank you to our farmers for all they do for America &amp; Iowa! 

RT to show your support! https://t.co/0NYvkWwiOI",202,15,4,1,50,True,1,False,False,null,,null,0,"IA04,NationalFarmersDay",2
1314725641749749762,"Feenstra, Randy",True,False,R,IOWA 4,RandyFeenstra,10/10/2020 00:33:14,Spent the afternoon in Iowa Falls with Senator @SweeneyforIowa and Speaker @PatGrassley - two leaders who know how to deliver for Iowa. By working together with #IA04 small businesses we can ensure our rural main streets thrive! #Feenstradelivers https://t.co/6XbkkvwZKl,270,8,7,2,35,True,4,False,False,null,,"SweeneyforIowa,PatGrassley",2,"IA04,Feenstradelivers",2
1314656897346220033,"Feenstra, Randy",True,False,R,IOWA 4,RandyFeenstra,10/09/2020 20:00:04,"“At the end of the day he wants to deliver and he does deliver. He’s done that in the Senate and now we just need him in the US House.”

-Rep. Megan Jones #IA04 https://t.co/iUNItEZJFN",184,4,7,0,18,True,2,False,False,null,,null,0,IA04,1
1314600080507371525,"Feenstra, Randy",True,False,R,IOWA 4,RandyFeenstra,10/09/2020 16:14:17,"Agriculture is the economic lifeblood of #IA04.  Having a strong voice on the Ag Committee is key to prosperity for our family farmers, mainstreets and Iowa economy.  I’ll deliver in DC just like I have in the Iowa Senate #FeenstraDelivers

https://t.co/smfZeGCebr",264,4,2,1,17,False,0,False,False,null,,null,0,"IA04,FeenstraDelivers",2
1314292172561289218,"Feenstra, Randy",True,False,R,IOWA 4,RandyFeenstra,10/08/2020 19:50:46,"I was just at the NW Iowa Sheriffs meeting with 16 great sheriffs including @SheriffDaveDrew &amp; Mike Van Otterloo

#IA04 is blessed with some of the best, most thoughtful officers in the country - I’m glad we got to talk about mental health and how we can support them in Congress! https://t.co/g7mlH72miV",308,7,5,1,34,True,1,False,False,null,,SheriffDaveDrew,1,IA04,1
1314028207612592132,"Feenstra, Randy",True,False,R,IOWA 4,RandyFeenstra,10/08/2020 02:21:52,"I agree, @Mike_Pence. It doesn’t matter if they call it the Green New Deal, the Biden New Deal or the JD Scholten New Deal...it’s no deal. It will kill Iowa jobs, hurt Iowa families and decimate Iowa farming. We can’t afford it and in Congress I’ll fight it every day. #IA04",274,19,18,2,97,False,0,False,False,null,,Mike_Pence,1,IA04,1
1314001999797649408,"Feenstra, Randy",True,False,R,IOWA 4,RandyFeenstra,10/08/2020 00:37:44,"I support working towards a cleaner environment, but the extreme environmental agenda proposed by @JDScholten and his allies is bad for #IA04 and dangerous for the future of Iowa - period.

https://t.co/CLFnNR97mG",213,4,8,0,20,False,0,False,False,null,,JDScholten,1,IA04,1
1313950133214642184,"Feenstra, Randy",True,False,R,IOWA 4,RandyFeenstra,10/07/2020 21:11:38,"It’s been a great afternoon in Spencer with Rep. Megan Jones, walking Main Street and meeting with small business owners at IGL, Pressed, Modern Woodman and Arts on Grand. Great innovators and philanthropists that are the back bone of our #IA04 main streets! https://t.co/Impnt6eluX",282,2,4,0,20,True,4,False,False,null,,null,0,IA04,1
1313886730450329600,"Feenstra, Randy",True,False,R,IOWA 4,RandyFeenstra,10/07/2020 16:59:42,"Great to be in Ida Grove yesterday visiting area businesses driving #IA04! Thanks for having me! #FeenstraDelivers

https://t.co/7GqyIfE7Ck",139,2,1,0,9,False,0,False,False,null,,null,0,"IA04,FeenstraDelivers",2
1313651132925964311,"Feenstra, Randy",True,False,R,IOWA 4,RandyFeenstra,10/07/2020 01:23:31,"Great to be in Monona County tonight speaking to an energized group of republicans. We need to make sure @MattWindschitl remains Majority Leader so we can continue to deliver results for Iowa families, farmers and rural main streets! #IA04 #Feenstradelivers https://t.co/9yQAcmsSDo",281,5,2,0,16,True,2,False,False,null,,MattWindschitl,1,"IA04,Feenstradelivers",2
1313622208288358400,"Feenstra, Randy",True,False,R,IOWA 4,RandyFeenstra,10/06/2020 23:28:35,It has been a great day in Ida Grove touring Gomaco and Midwest Industries &amp; meeting with workers. Innovative #IA04 businesses with global footprints! Joined Ryan on Storm Lake radio to chat about the visits and how we can deliver results. Now off to Mapleton! #Feenstradelivers https://t.co/4MGJSIXoVJ,306,2,8,0,28,True,4,False,False,null,,null,0,"IA04,Feenstradelivers",2
1313503548987015174,"Feenstra, Randy",True,False,R,IOWA 4,RandyFeenstra,10/06/2020 15:37:04,"Proud to have the support of @NieuwenhuisSeed and the Iowa Corn Growers! 

I have a track record of delivering results for farmers &amp; ethanol producers in #IA04, and I’m ready to take that record to Congress and work with @joniernst &amp; @chuckgrassley to get things done for Iowa! https://t.co/N9bHtkbsje",309,6,7,0,31,True,1,False,False,null,,"NieuwenhuisSeed,joniernst,ChuckGrassley",3,IA04,1
1312807854043168770,"Feenstra, Randy",True,False,R,IOWA 4,RandyFeenstra,10/04/2020 17:32:37,We won’t. https://t.co/nTIQwspZ2e,33,4,19,1,54,False,0,False,False,null,,null,0,null,0
1312542096528736257,"Feenstra, Randy",True,False,R,IOWA 4,RandyFeenstra,10/03/2020 23:56:36,Final stop of the day in Hamilton County. Great to be speak about how we can deliver results for #IA04 and send @joniernst back to the senate. Tune into @WHO13news tonight to catch the #IASEN debate and the 21st to catch the 4th district debate! #Feenstradelivers https://t.co/aEAfCJJkvq,287,9,10,2,48,True,1,False,False,null,,"joniernst,WHO13news",2,"IA04,IASEN,Feenstradelivers",3
1312473583659016192,"Feenstra, Randy",True,False,R,IOWA 4,RandyFeenstra,10/03/2020 19:24:21,It was nice to be in Boone County this afternoon talking about how we can deliver for Iowans with @ebranstad @KimReynoldsIA @MattWhitaker46. A special thanks to the men and women of law enforcement who keep us safe and protect our communities. #IA04 https://t.co/lBi7lNpZNk,273,13,19,2,58,True,4,False,False,null,,"ebranstad,KimReynoldsIA,MattWhitaker46",3,IA04,1
1312421073221308416,"Feenstra, Randy",True,False,R,IOWA 4,RandyFeenstra,10/03/2020 15:55:42,"Great start to a day on the trail with @KimReynoldsIA, @CarlinIowaHouse, @WillsforIowa and a great group that’s ready to work hard and deliver for Iowa! Currently: 

📍Crawford County

Next stop: 

📍Boone County

See you there! #IA04 https://t.co/FnBVYEMVgj",256,16,27,1,48,True,2,False,False,null,,"KimReynoldsIA,CarlinIowaHouse,willsforiowa",3,IA04,1
1312034867253776385,"Feenstra, Randy",True,False,R,IOWA 4,RandyFeenstra,10/02/2020 14:21:03,"Today, Lynette and I are praying for the President, the First Lady, and all Americans affected by this pandemic. May they all be blessed with strength and a speedy recovery, and our nation with the grace and resolve to overcome this trial.",239,6,5,1,61,False,0,False,False,null,,null,0,null,0
1311441646391787520,"Feenstra, Randy",True,False,R,IOWA 4,RandyFeenstra,09/30/2020 23:03:48,"This is the result of effective, conservative leadership.  #FeenstraDelivers https://t.co/z6nLfevbEs",100,13,18,1,69,False,0,False,False,null,,null,0,FeenstraDelivers,1
1311052398505472002,"Feenstra, Randy",True,False,R,IOWA 4,RandyFeenstra,09/29/2020 21:17:04,"It’s been a couple of busy days on the trail - I met with the Home Builders Association &amp; Farm Bureau to discuss economic development in #IA04

I’m glad to have their support and I’m looking forward to working with them to help grow Iowa’s economy &amp; communities! #FeenstraDelivers https://t.co/eHEPLwQwS5",312,8,12,0,20,True,3,False,False,null,,null,0,"IA04,FeenstraDelivers",2
1310278917987741702,"Feenstra, Randy",True,False,R,IOWA 4,RandyFeenstra,09/27/2020 18:03:32,Join me in prayer over the coming weeks for the Barrett family.  May God protect and bless them. https://t.co/Cvo9VDt6Rb,120,15,13,2,194,True,1,False,False,null,,null,0,null,0
1309963315213488129,"Feenstra, Randy",True,False,R,IOWA 4,RandyFeenstra,09/26/2020 21:09:26,"Amy Coney Barrett is a distinguished jurist and will make a great Justice for years to come - great nomination @realdonaldtrump

I look forward to the Senate confirming the nomination! https://t.co/3w7bTnL1h5",208,4,7,1,39,False,0,False,True,null,,realDonaldTrump,1,null,0
1309586273368190976,"Feenstra, Randy",True,False,R,IOWA 4,RandyFeenstra,09/25/2020 20:11:13,"Iowa is one of the nation’s leaders in #CleanEnergy and serves as a model for the rest of America. 

Going forward, we can continue to lead the nation in this growing industry and help keep America &amp; #IA04 energy independent and competitive! #NCEW20🇺🇸🇺🇸",257,4,6,1,22,False,0,False,False,null,,null,0,"CleanEnergy,IA04,NCEW20",3
1309511609941987331,"Feenstra, Randy",True,False,R,IOWA 4,RandyFeenstra,09/25/2020 15:14:32,"Glad to see @realdonaldtrump acting to fill the vacant Supreme Court seat - his list of potential nominees is full of great legal scholars that will uphold our constitution, and I look forward to the Senate confirmation!",220,10,4,0,49,False,0,False,False,null,,realDonaldTrump,1,null,0
1309160408960430082,"Feenstra, Randy",True,False,R,IOWA 4,RandyFeenstra,09/24/2020 15:58:59,"It was a great opportunity to see up-close the innovations in new energy Iowa has managed to harness. 

We’re a leading state in renewable energy in a country that’s moving more and more in that direction, and #IA04 can continue leading that charge. 

https://t.co/YkuXWLDuA6",275,2,4,0,13,False,0,False,False,null,,null,0,IA04,1
1308884320564776962,"Feenstra, Randy",True,False,R,IOWA 4,RandyFeenstra,09/23/2020 21:41:54,Official White House Photo by Joyce N. Boghosian,48,7,2,1,25,False,0,False,False,RandyFeenstra,1308884318551445506,null,0,null,0
1308884318551445506,"Feenstra, Randy",True,False,R,IOWA 4,RandyFeenstra,09/23/2020 21:41:54,"Today in the Oval Office I had a productive talk with President @realdonaldtrump about the necessity of protecting unborn life, supporting farmers in #IA04, and promoting ethanol &amp; biofuels. 

I look forward to delivering results together when I’m in Congress! #FeenstraDelivers https://t.co/7XP6WHppaN",306,55,34,12,390,True,1,False,False,null,,realDonaldTrump,1,"IA04,FeenstraDelivers",2
1308575325043990529,"Feenstra, Randy",True,False,R,IOWA 4,RandyFeenstra,09/23/2020 01:14:04,Glad I got the opportunity to join @IowaBossman and the Woodbury County GOP tonight to talk about what we’ve accomplished in Iowa and what we plan on doing in for #IA04 in Congress! Thanks for having me! #FeenstraDelivers https://t.co/S5gdsa13Oz,245,4,3,1,28,True,2,False,False,null,,IowaBossMan,1,"IA04,FeenstraDelivers",2
1308495771151618049,"Feenstra, Randy",True,False,R,IOWA 4,RandyFeenstra,09/22/2020 19:57:57,"I’ve been all over #IA04 this morning discussing energy initiatives that

👨‍🔧Create jobs
🔌Power Iowa 
🇺🇸Keep us energy independent

We’re a leading state in new energy, and going forward we can make sure America dominates 21st century energy innovation! #FeenstraDelivers https://t.co/z3Bhb05P2o",295,10,3,0,31,True,3,False,False,null,,null,0,"IA04,FeenstraDelivers",2
1308153227808997376,"Feenstra, Randy",True,False,R,IOWA 4,RandyFeenstra,09/21/2020 21:16:48,"This is dangerous &amp; unacceptable. The fiscal irresponsibility of Washington has destabilized our country &amp; jeopardized our kids’ futures.

We MUST take action to balance our budget and bring down our debt - that’s what I did in the Iowa Senate and what I’ll do in Congress #IA04 https://t.co/Jhu8coDTR1",310,6,15,1,28,False,0,False,False,null,,null,0,IA04,1
1308077584924766211,"Feenstra, Randy",True,False,R,IOWA 4,RandyFeenstra,09/21/2020 16:16:13,"ICYMI: I received the endorsement of @Iowa_Corn last week! 

I’m proud to have their support, and farm families in #IA04 can count on me to have their backs in Washington! #FeenstraDelivers https://t.co/rkom5goqID",213,2,1,0,21,True,1,False,False,null,,iowa_corn,1,"IA04,FeenstraDelivers",2
1307775817674625024,"Feenstra, Randy",True,False,R,IOWA 4,RandyFeenstra,09/20/2020 20:17:06,"It was great to see my friend and colleague @millermeeks at the Faith and Freedom dinner last night.

Mariannette is a doctor, a veteran and strong voice for Iowa. We need her in Congress. Head to https://t.co/wFnn388J9v to chip in $5 $10 or $20 - let’s help MMM flip #IA02! https://t.co/YiHGp0KbwZ",298,5,5,3,25,True,1,False,False,null,,millermeeks,1,IA02,1
1307393519934476300,"Feenstra, Randy",True,False,R,IOWA 4,RandyFeenstra,09/19/2020 18:58:00,"Great to be with the Iowa Federation of Republican Women and a great group of speakers this afternoon! 

We got the chance to talk about the issues facing our nation - protecting life, supporting farmers, balancing the budget, and how I’ll deliver for #IA04. Thanks for having me! https://t.co/jMVckCJ6PK",304,3,3,1,22,True,2,False,False,null,,null,0,IA04,1
1307339891831910406,"Feenstra, Randy",True,False,R,IOWA 4,RandyFeenstra,09/19/2020 15:24:54,I was saddened to learn of the passing of trailblazer Ruth Bader Ginsburg. My family and I offer our sincerest condolences to her family and loved ones. May she Rest In Peace.,175,9,2,0,35,False,0,False,False,null,,null,0,null,0
1307078764187316225,"Feenstra, Randy",True,False,R,IOWA 4,RandyFeenstra,09/18/2020 22:07:16,"After 3 debates with my opponent, the Iowa Corn Growers have endorsed our campaign. 

They know I’ll deliver results for Iowa farm families in Congress just like I did in the Senate. 

Honored to have the support of @Iowa_corn &amp; @IowaFarmBureau! #IA04 #FeenstraDelivers https://t.co/ZYQSnJWgEw",297,18,7,2,52,True,1,False,False,null,,"iowa_corn,IowaFarmBureau",2,"IA04,FeenstraDelivers",2
1307018306721910785,"Feenstra, Randy",True,False,R,IOWA 4,RandyFeenstra,09/18/2020 18:07:02,Our country is stronger and safer when we don’t have to rely on our rivals. It’s important that we get critical links in our supply chains out of China and we make sure we see “Made in America” on our products again #IA04 #FeenstraDelivers https://t.co/GQ3s81LTkH,263,2,5,0,10,True,1,False,False,null,,null,0,"IA04,FeenstraDelivers",2
1306712374288814081,"Feenstra, Randy",True,False,R,IOWA 4,RandyFeenstra,09/17/2020 21:51:22,Nothing but grace and class from @JoniErnst in the face of despicable slander. That’s the mark of a great leader. #IASen https://t.co/OeIkY4ZAPF,144,18,7,0,90,False,0,False,False,null,,joniernst,1,IASen,1
1306609689120120832,"Feenstra, Randy",True,False,R,IOWA 4,RandyFeenstra,09/17/2020 15:03:20,Happy birthday to @ChuckGrassley! Thanks for all you do for our state and our country! #GrassleyWorks https://t.co/xqmYMjDg8u,125,4,2,0,35,True,1,False,False,null,,ChuckGrassley,1,GrassleyWorks,1
1306371606709755905,"Feenstra, Randy",True,False,R,IOWA 4,RandyFeenstra,09/16/2020 23:17:16,"Thanks to @ShawGOP and the Quad County Corn Processors for having me today! 

We had a great conversation about #IA04 ethanol and what we can do to help the industry &amp; our farmers. Bottom line: we need to stop the EPA from undermining our state #FeenstraDelivers https://t.co/hD8WhwOfN7",290,5,2,0,15,True,2,False,False,null,,ShawGOP,1,"IA04,FeenstraDelivers",2
1306261195360530432,"Feenstra, Randy",True,False,R,IOWA 4,RandyFeenstra,09/16/2020 15:58:32,"The denial of gap year waivers for refineries is a big win for #IA04, but there’s progress to be made yet. 

@JoniErnst has fought hard for Iowa biofuels in the Senate, but we need effective conservatives in the House that will join her in fighting for Iowa! #FeenstraDelivers https://t.co/ThBfc5i34p",300,8,3,1,26,True,1,False,False,null,,joniernst,1,"IA04,FeenstraDelivers",2
1306056258684891137,"Feenstra, Randy",True,False,R,IOWA 4,RandyFeenstra,09/16/2020 02:24:12,"Great to be in Sheldon tonight with the Iowa Corn Growers Association! 

Farmers are the backbone of #IA04 - I delivered for them in the Iowa Senate and I’ll deliver for them in Congress. That’s why I was named a Friend of Agriculture by @IowaFarmBureau 

#FeenstraDelivers https://t.co/MsY409eUJ9",297,7,9,0,40,True,1,False,False,null,,IowaFarmBureau,1,"IA04,FeenstraDelivers",2
1305534604447748096,"Feenstra, Randy",True,False,R,IOWA 4,RandyFeenstra,09/14/2020 15:51:20,"NEW AD: The choice is clear: I have always delivered for Iowa farmers. JD Scholten supports the Green New Deal, an extreme environmental scheme that will be devastating for Iowa farmers. Our farm families can’t afford his radical agenda. https://t.co/DveWbEVRFs",261,14,17,2,29,False,0,False,True,null,,null,0,null,0
1305517312573927426,"Feenstra, Randy",True,False,R,IOWA 4,RandyFeenstra,09/14/2020 14:42:37,"Congratulations to Ambassador Terry Branstad on his return to America after many years of delivering for our state and our country abroad! 

Welcome home, Ambassador 🇺🇸",168,7,3,0,47,False,0,False,False,null,,null,0,null,0
1304803628289536000,"Feenstra, Randy",True,False,R,IOWA 4,RandyFeenstra,09/12/2020 15:26:41,College football is back! Today #TeamFeenstra is rocking our Iowa State colors. Go Cyclones! https://t.co/1SsteLmtNk,116,9,2,0,34,True,1,False,False,null,,null,0,TeamFeenstra,1
1304801914949951489,"Feenstra, Randy",True,False,R,IOWA 4,RandyFeenstra,09/12/2020 15:19:53,Great news for Iowa! Thank you @joniernst and @realDonaldTrump! #IASen #IA04 https://t.co/ZXPCKoxDvl,100,8,5,1,67,False,0,False,False,null,,"joniernst,realDonaldTrump",2,"IASen,IA04",2
1304538631986728961,"Feenstra, Randy",True,False,R,IOWA 4,RandyFeenstra,09/11/2020 21:53:41,"Join #TeamFeenstra, @TeamJoni, and @TrumpVictoryIA for a day of action in #IA04! 

We’ll have volunteers in Sioux City to knock doors and make calls. Join us and make a difference!

Contact to get involved:
josh@feenstraforcongress.com courtney@feenstraforcongress.com https://t.co/JXGaCpGiWX",292,6,3,0,22,True,1,False,False,null,,"TeamJoni,TrumpVictoryIA",2,"TeamFeenstra,IA04",2
1304508433849372672,"Feenstra, Randy",True,False,R,IOWA 4,RandyFeenstra,09/11/2020 19:53:41,"ICYMI:

@IowaFarmBureau named me a Friend of Agriculture for my work in the Iowa Senate where we

☑️Eliminated the grain bin tax
☑️Helped first time farmers
☑️Supported ethanol producers 

And in Congress I’ll continue to deliver for agriculture! #IA04 #FeenstraDelivers https://t.co/3PykSj7uj7",294,2,1,1,11,True,1,False,False,null,,IowaFarmBureau,1,"IA04,FeenstraDelivers",2
1304412175205830658,"Feenstra, Randy",True,False,R,IOWA 4,RandyFeenstra,09/11/2020 13:31:12,"Never forget those who lost their lives 19 years ago today, and the sacrifice of those who answered their nation’s call. Let’s keep them all in our prayers today. 

#NeverForget",177,5,2,0,49,False,0,False,False,null,,null,0,NeverForget,1
1304227975290851328,"Feenstra, Randy",True,False,R,IOWA 4,RandyFeenstra,09/11/2020 01:19:15,"Great talk with @drcodyhoefert tonight about my time in the Iowa Senate, how I delivered, and how I’ll get it done in Congress too. 

Thanks to the folks of Plymouth County for having me! #IA04 #FeenstraDelivers https://t.co/LZujIcVdaa",235,6,7,1,21,True,2,False,False,null,,drcodyhoefert,1,"IA04,FeenstraDelivers",2
1304087359772921860,"Feenstra, Randy",True,False,R,IOWA 4,RandyFeenstra,09/10/2020 16:00:29,"My opponent has received over a million dollars in donations from out of state, and that money is being spent to put a smiling face on a radical agenda. Chip in below to help us push back!

https://t.co/tUYIGEH8Ol https://t.co/0gc58mn562",237,6,5,1,20,True,1,False,False,null,,null,0,null,0
1303806387978416128,"Feenstra, Randy",True,False,R,IOWA 4,RandyFeenstra,09/09/2020 21:24:01,"I’m so proud to be named a Friend of Agriculture by @IowaFarmBureau, and in Congress I’ll be proud to stand on the values we share: faith, family, and a commitment to Iowa’s farmers and rural communities #IA04 #FeenstraDelivers

https://t.co/VSgaDa3sKb",252,10,4,1,44,False,0,False,False,null,,IowaFarmBureau,1,"IA04,FeenstraDelivers",2
1303458061051363329,"Feenstra, Randy",True,False,R,IOWA 4,RandyFeenstra,09/08/2020 22:19:53,"Our opponent supports a radical agenda including the Green New Deal that would give those unwilling to work taxpayer funded income.

He’s spending thousands of dollars on TV to put a smiling face on a radical agenda.

Chip in to help us defend #IA04 ⬇️

https://t.co/tUYIGEH8Ol https://t.co/qTUOuBMHAQ",301,3,4,0,12,True,1,False,False,null,,null,0,IA04,1
1303107952216354821,"Feenstra, Randy",True,False,R,IOWA 4,RandyFeenstra,09/07/2020 23:08:41,.@hinsonashley’s Iowa common sense is much needed in Congress! Tune in tonight and chip in to help Ashley finish strong at https://t.co/nFMvD7YnCu #IA01 https://t.co/8CAWtEnByx,176,4,4,0,27,False,0,False,False,null,,hinsonashley,1,IA01,1
1303042781309526017,"Feenstra, Randy",True,False,R,IOWA 4,RandyFeenstra,09/07/2020 18:49:43,God bless the working men and women that make this country great! 🇺🇸 https://t.co/Vrf1lBDT61,92,3,1,0,17,False,0,False,False,null,,null,0,null,0
1302338638508949504,"Feenstra, Randy",True,False,R,IOWA 4,RandyFeenstra,09/05/2020 20:11:42,"Thank you @realDonaldTrump for your unwavering support of innocent lives! 

When I’m in Congress, I’ll be first in line to back the President’s effort to stop taxpayer money going to end the lives of the unborn #IA04 https://t.co/h693RIZ4qC",240,4,5,0,24,True,1,False,False,null,,realDonaldTrump,1,IA04,1
1301615617842262016,"Feenstra, Randy",True,False,R,IOWA 4,RandyFeenstra,09/03/2020 20:18:40,"A vital relief package to protect small businesses, schools, and our post office is being held up by Nancy Pelosi, who is demanding billions of dollars to bail out mismanaged states like Illinois and California. 

#IA04 shouldn’t foot the bill for their negligence! https://t.co/hw1EOha31N",289,4,14,0,30,True,1,False,False,null,,null,0,IA04,1
1323395277731078149,J. D. Scholten,False,False,D,IOWA 4,JDScholten,11/02/2020 22:43:16,"You can't trust Randy Feenstra to protect people with pre-existing conditions.

His ""health benefit plan"" is not even legally allowed to be called insurance because it charges higher rates or denies care if you have a pre-existing condition like diabetes or heart disease. https://t.co/B5J0tVpiri",296,52,3,2,207,False,0,False,True,null,,null,0,null,0
1323382912469913600,J. D. Scholten,False,False,D,IOWA 4,JDScholten,11/02/2020 21:54:08,@rmitch40 🙏,11,0,0,0,2,False,0,False,False,rmitch40,1323382475322699777,rmitch40,1,null,0
1323357176744808454,J. D. Scholten,False,False,D,IOWA 4,JDScholten,11/02/2020 20:11:52,"Come out to our last parking lot rally tonight in Ames!

We’ll be at the North River Valley Park at 6:45pm.

https://t.co/LSsifXVvWh",132,17,1,1,52,False,0,False,False,null,,null,0,null,0
1323338615120945152,J. D. Scholten,False,False,D,IOWA 4,JDScholten,11/02/2020 18:58:06,"My health care policy boils down to one thing: putting your health before the profits of the pharmaceutical and insurance companies.

https://t.co/V63a6T3go5",157,34,3,1,109,False,0,False,False,null,,null,0,null,0
1323306246259224576,J. D. Scholten,False,False,D,IOWA 4,JDScholten,11/02/2020 16:49:29,"When Randy Feenstra could have passed any bill, he gave nursing home executives legal immunity instead of protecting seniors or the frontline workers in nursing homes.

43% of nursing homes don't have a 1 week supply of PPE!!! https://t.co/ePBXb3UAZE",250,66,2,4,170,False,0,False,False,null,,null,0,null,0
1323281160915636224,J. D. Scholten,False,False,D,IOWA 4,JDScholten,11/02/2020 15:09:48,Proud to have so many grassroots supporters on our team. Post your own video in the comments about why you're supporting our campaign! https://t.co/M5Ul3615gs,158,44,4,6,139,False,0,False,True,null,,null,0,null,0
1323254555484790784,J. D. Scholten,False,False,D,IOWA 4,JDScholten,11/02/2020 13:24:05,Today is a great day to convince someone who wasn’t going to vote to vote! 🗳,76,115,18,3,999,False,0,False,False,null,,null,0,null,0
1323086201570680834,J. D. Scholten,False,False,D,IOWA 4,JDScholten,11/02/2020 02:15:06,A huge thank you to all of the field organizers and volunteers who are working their tails off this election! 🙏🙏🙏,113,51,5,3,653,False,0,False,False,null,,null,0,null,0
1323075778779717633,J. D. Scholten,False,False,D,IOWA 4,JDScholten,11/02/2020 01:33:41,@ZephyrTeachout @JulieOliverTX 🙏,32,0,0,0,5,False,0,False,False,ZephyrTeachout,1323063225320091648,"ZephyrTeachout,JulieOliverTX",2,null,0
1323054788280537090,J. D. Scholten,False,False,D,IOWA 4,JDScholten,11/02/2020 00:10:17,@MonetaRoyalty You’re not the first person that I’ve seen want this changed.,76,0,2,0,3,False,0,False,False,MonetaRoyalty,1323053127969476608,MonetaRoyalty,1,null,0
1323039737674956801,J. D. Scholten,False,False,D,IOWA 4,JDScholten,11/01/2020 23:10:29,I appreciate @rassmith62 making the trip up!!! https://t.co/MhJObTThX6 https://t.co/tVQLR3mBBs,94,11,0,0,82,True,1,False,False,null,,null,0,null,0
1322959846820487171,J. D. Scholten,False,False,D,IOWA 4,JDScholten,11/01/2020 17:53:01,@lucygiehl Went to college at Grinnell.,39,0,0,0,1,False,0,False,False,ljeller62,1322959639747743747,null,0,null,0
1322945773076709377,J. D. Scholten,False,False,D,IOWA 4,JDScholten,11/01/2020 16:57:06,"One of my favorite things about Iowa is that it has a remarkable influence on people. And when they go on to do great things, they don’t forget about their home. Honored to have this great support. https://t.co/tONe7SyAOP",221,119,5,24,508,False,0,False,True,null,,null,0,null,0
